,meme_id,plantilla,texto_no_tilde,text_1,text_2
93481,003,Ay Si,ay si tu crees que nadie esta a tu nivel madura chivola taz en pañales,ay si, tu crees que nadie esta a tu nivel madura chivola taz en pañales
93487,003,Ay Si,Ay si ay si Me lastiman sus comentarios,Ay si ay si, Me lastiman sus comentarios
93489,003,Ay Si,ay si ay si nadie me gana en las carreras,ay si ay si, nadie me gana en las carreras
93494,011,Problems,me quiere cojer y yo sin gana,me quiere cojer, y yo sin gana
93502,011,Problems,ademas me va doler..ni me la ha topado y ya me duele,ademas me va doler..ni me la ha topado, y ya me duele
93509,012,Willy Wonka,asi q te disen robocop? dime q se siente ser de acero?,asi q te disen robocop? ,dime q se siente ser de acero?
93514,004,Bad Luck Brian,Pide que lo inviten le parten la raja,Pide que, lo inviten le parten la raja
93515,004,Bad Luck Brian,Pide que lo inviten al KI Le parten el kueno,Pide que, lo inviten al KI Le parten el kueno
93544,011,Problems,Soy Hiart y hoy toca mojar Con Aritz,Soy Hiart, y hoy toca mojar Con Aritz
93547,008,Matias Prats,ultimas noticias gana chile,ultimas noticias, gana chile
93579,004,Bad Luck Brian,Le pide ejecutor lo pekean,Le pide ejecutor, lo pekean
93580,004,Bad Luck Brian,Se siente el rey del troll No la aguanta y se va a dormmir,Se siente el rey del troll No la aguanta y, se va a dormmir
93602,012,Willy Wonka,¿ese es el argumento de rogue one? cuentame mas,¿ese es el argumento de rogue one? ,cuentame mas
93616,011,Problems,Sola la puntita dijo y la clavo entera,Sola la puntita dijo, y la clavo entera
93693,004,Bad Luck Brian,nunca te ha pasado sacas el celular para ver la hora y lo sacas de nuevo para volverla a ver xq se te olvidn,nunca te ha pasado sacas el celular para ver la hora y, lo sacas de nuevo para volverla a ver xq se te olvidn
93708,011,Problems,cuando una papa vale 200$ y solo tienes 150$,cuando una papa vale 200$, y solo tienes 150$
93765,004,Bad Luck Brian,Saluda Nadie le responde,Saluda Nadie, le responde
93911,006,Filosoraptor,¿SI Oleguer Pujol era rico a los 20 es una nueva especie: el velocicorruptor?,,¿SI Oleguer Pujol era rico a los 20 es una nueva especie: el velocicorruptor?
94007,003,Ay Si,Ay si ay si Ahora soy fan de Coldplay,Ay si ay si, Ahora soy fan de Coldplay
94085,004,Bad Luck Brian,sube un video de su cumpleaños lo denuncian por spam,sube un video de su cumpleaños, lo denuncian por spam
94122,004,Bad Luck Brian,se compra su primer auto se lo roban y lo violan,se compra su primer auto, se lo roban y lo violan
94159,003,Ay Si,"ay si, ay si, ay si volvi con mi ex",ay si ay si, ay si volvi con mi ex
94169,004,Bad Luck Brian,se va a cancun a ver si pega el chicle se lleva a la suegra,se va a cancun a ver si pega el chicle, se lleva a la suegra
94237,003,Ay Si,Ay si ay si Cuentame algo De yhess y se lo pego a su wsp,Ay si ay si, Cuentame algo De yhess y se lo pego a su wsp
94242,003,Ay Si,Ay si ay si Cuentame algo De yhess y se lo pego a su wso,Ay si ay si, Cuentame algo De yhess y se lo pego a su wso
94279,006,Filosoraptor,¿que le dice una nalga a otra nalga? solo una raya nos separa,,¿que le dice una nalga a otra nalga? solo una raya nos separa
94328,008,Matias Prats,ultimas noticias avion que se dirigia a argentina se estrello se dice que hay mano negra en esto!!,ultimas noticias, avion que se dirigia a argentina se estrello se dice que hay mano negra en esto!!
94335,011,Problems,si no publica fotos contigo y ni te publica cuidado con los cachos,si no publica fotos contigo, y ni te publica cuidado con los cachos
94342,008,Matias Prats,De ultima hora Estamos a full en la feria chevrolet,De ultima hora, Estamos a full en la feria chevrolet
94368,004,Bad Luck Brian,fiesta en su casa no lo invitan,fiesta en su casa no, lo invitan
94395,011,Problems,me dijo que no queria nada publico en las redes sociales por privacidad y le crei. ... Pero era para demostrarle a otra que no tenia nada con nadie,me dijo que no queria nada publico en las redes sociales por privacidad, y le crei. ... Pero era para demostrarle a otra que no tenia nada con nadie
94413,012,Willy Wonka,"Asi que tienes novia? dime, ya le contaste tu pasado oscuro?",Asi que tienes novia? ,dime ya le contaste tu pasado oscuro?
94425,004,Bad Luck Brian,Va a un karaoke le ponen I,Va a un karaoke, le ponen I
94427,012,Willy Wonka,"dime que se siente no cepillarse ,que te digan morza y que ni tu mama te quiera",,dime que se siente no cepillarse que te digan morza y que ni tu mama te quiera
94511,003,Ay Si,ay si yo se programar en c++ soy chyte y programo,ay si, yo se programar en c++ soy chyte y programo
94513,004,Bad Luck Brian,Mija tu que eres maestra en NI Ve x tu papa k se le quedo la combi en berlin esq con holanda,Mija tu que eres maestra en NI Ve x tu papa k, se le quedo la combi en berlin esq con holanda
94577,003,Ay Si,"Ay si, ay siiii.... Mis tenis metarun",Ay si ay si,iii.... Mis tenis metarun
94631,003,Ay Si,ay si ay si todos los bebitos son mejor que yo,ay si ay si, todos los bebitos son mejor que yo
94637,004,Bad Luck Brian,ya se juega en el estadio despues de un siglo penadoy vs diluvio aaaaaaa,ya, se juega en el estadio despues de un siglo penadoy vs diluvio aaaaaaa
94638,003,Ay Si,uy si uy si mi abuelita me matara,uy si uy si, mi abuelita me matara
94738,003,Ay Si,ay si !! ahora todas venden test de embarazo,ay si, !! ahora todas venden test de embarazo
94755,003,Ay Si,"Ay si ay si la banda no que por corriente Mejor canto el bass bout that bass, no treble aunque ni le entienda y sea mas naco jajajaja.....",Ay si ay si, la banda no que por corriente Mejor canto el bass bout that bass no treble aunque ni le entienda y sea mas naco jajajaja.....
94780,007,Futurama Fry,No se si mi vieja me dejo por que tomo o tomo por que me dejo mi vieja,No se si mi vieja me dejo por que tomo, o tomo por que me dejo mi vieja
94917,003,Ay Si,uy si tengo muchos dulces!,uy si, tengo muchos dulces!
94941,007,Futurama Fry,Que sera mejor beber o no beber,Que sera mejor beber, o no beber
94992,003,Ay Si,Hay si estoy Careta Por eso Me inspiro tanto,Hay si, estoy Careta Por eso Me inspiro tanto
95004,003,Ay Si,Ay si ay si No te ballas a rallar,Ay si ay si, No te ballas a rallar
95013,003,Ay Si,ay si ay si todo menos en la cara,ay si ay si, todo menos en la cara
95015,003,Ay Si,hay si mama joven mira tu aprende que es el sexo antes de hacerlo,hay si, mama joven mira tu aprende que es el sexo antes de hacerlo
95035,011,Problems,Pense que Manuel y Alex Ya no harian comentarios acidos,Pense que Manuel, y Alex Ya no harian comentarios acidos
95041,004,Bad Luck Brian,Pone Link pa guillarse con los panas no se ve,Pone Link pa guillarse con los panas no, se ve
95056,008,Matias Prats,noticia de ultima hora extraviados hinchas del barcelona,noticia de ultima hora, extraviados hinchas del barcelona
95138,011,Problems,No puede ser hoy no saldre y tan bonita q estan la musicas,No puede ser hoy no saldre, y tan bonita q estan la musicas
95145,003,Ay Si,uy si uy si que malota jajaXD,uy si uy si, que malota jajaXD
95185,011,Problems,Cuando el tavo te gana 2 veces y no paras de llorar,Cuando el tavo te gana 2 veces, y no paras de llorar
95193,003,Ay Si,Ay si ay si Nadi,Ay si ay si, Nadi
95194,003,Ay Si,Ay si ay si No subo a ver a mi mary,Ay si ay si, No subo a ver a mi mary
95235,003,Ay Si,"¡Ay si, ay si! yo no tengo horario chavo",¡Ay si ay si,! yo no tengo horario chavo
95270,013,Yao Wonka,johana quieres q te diga algo si dime no te mandaron a la disco jjjjjjjjjj,johana quieres q te diga algo si ,dime no te mandaron a la disco jjjjjjjjjj
95272,007,Futurama Fry,no se si ponerte 1000 velas o un cirio pascual,no se si ponerte 1000 velas, o un cirio pascual
95368,007,Futurama Fry,me pregunto si esos que se sacan fotos en pareja son felices o infelices?,me pregunto si esos que se sacan fotos en pareja son felices, o infelices?
95372,003,Ay Si,"Ay si, ay si, ahora todo el mundo tiene negocio de las ""Pruebas de embarazo""",Ay si ay si," ahora todo el mundo tiene negocio de las ""Pruebas de embarazo"""
95386,004,Bad Luck Brian,dice que no es brasilero se llama Felipe,dice que no es brasilero, se llama Felipe
95404,007,Futurama Fry,te jamo o te quelo,te jamo, o te quelo
95416,011,Problems,odio que me quiera y no me lo demuestra,odio que me quiera, y no me lo demuestra
95444,011,Problems,me dijo llevame a la central y ni un chesco me invito,me dijo llevame a la central, y ni un chesco me invito
95529,003,Ay Si,uy si uy si vi como te quemaban una flota,uy si uy si, vi como te quemaban una flota
95573,003,Ay Si,"Ay si,ay si Estrena algun aparato y segun ella es un nuevo juguetito",Ay siay si, Estrena algun aparato y segun ella es un nuevo juguetito
95590,012,Willy Wonka,"asi que te acostaste con ella.. dime,que se siente besar la boca de la mujer que me la chupaba?",asi que te acostaste con ella.. ,dimeque se siente besar la boca de la mujer que me la chupaba?
95601,011,Problems,me dijo el german q ivamos al fut y me llevo al hotel...,me dijo el german q ivamos al fut, y me llevo al hotel...
95619,003,Ay Si,"ay si, ay si me voy a ver a los fabulosos cadillacs",ay si ay si, me voy a ver a los fabulosos cadillacs
95647,003,Ay Si,"ay si, ay si digo que soy fea para que los demas lo desmientan y me chuleen",ay si ay si, digo que soy fea para que los demas lo desmientan y me chuleen
95649,003,Ay Si,ay si ay si puro zacate,ay si ay si, puro zacate
95652,003,Ay Si,ay si aysi ahora hablo de tiges cuando yo antes le iva a los incomparables,ay si, aysi ahora hablo de tiges cuando yo antes le iva a los incomparables
95658,004,Bad Luck Brian,lo cortan y dice que le piden tiempo y distancia,lo cortan y dice que, le piden tiempo y distancia
95666,006,Filosoraptor,si ustedes quieren ganar los sorteos ¿por que hacen memes tan malos?,si ustedes quieren ganar los sorteos ,¿por que hacen memes tan malos?
95668,004,Bad Luck Brian,Dice que ryuko shion es fanboy de sonic Pero no se da cuenta de que el es uno de Mario,Dice que ryuko shion es fanboy de sonic Pero no, se da cuenta de que el es uno de Mario
95677,003,Ay Si,hay si es mi cuple!!! joseth bravo,hay si, es mi cuple!!! joseth bravo
95730,004,Bad Luck Brian,Va hasta Coacalco No lo dejan tocar,Va hasta Coacalco No, lo dejan tocar
95760,006,Filosoraptor,¿Algun dia Nacho Pasara la fase de grupos?,,¿Algun dia Nacho Pasara la fase de grupos?
95773,004,Bad Luck Brian,se va de pinta lo trincan,se va de pinta, lo trincan
95821,013,Yao Wonka,dime que se siente estar jalando bolas a los bomberos cuando no le querias dar la casa comunal y ahora estas como si fuiste tu quien los trajo,,dime que se siente estar jalando bolas a los bomberos cuando no le querias dar la casa comunal y ahora estas como si fuiste tu quien los trajo
95904,011,Problems,mi cuñado matias Ismael no hace mate ricos y me duele la panza,mi cuñado matias Ismael no hace mate ricos, y me duele la panza
95943,003,Ay Si,"Ay Si, ay si Solo los pudientes ofertan",Ay Si ay si, Solo los pudientes ofertan
95965,008,Matias Prats,En ultimas noticias El Hauler de Rene Rizo ya cotiza en wall street,En ultimas noticias, El Hauler de Rene Rizo ya cotiza en wall street
96018,003,Ay Si,ay si sergio,ay si, sergio
96134,006,Filosoraptor,Si los zombies entran a las subastas ¿Zombien aferrados?,Si los zombies entran a las subastas ,¿Zombien aferrados?
96169,008,Matias Prats,En las ultimas noticias !!Ya dejo de llover!!,En las ultimas noticias, !!Ya dejo de llover!!
96204,003,Ay Si,ay si... tanto escandalo por unos milloncitos que se choreo???,ay si,... tanto escandalo por unos milloncitos que se choreo???
96215,003,Ay Si,"hay hay si ,me creo guitarrista por tener una guitarra",hay hay si, me creo guitarrista por tener una guitarra
96327,008,Matias Prats,noticias de ultima hora el 15 de abril nos vamos de despedida de soltera,noticias de ultima hora, el 15 de abril nos vamos de despedida de soltera
96432,003,Ay Si,ay si te compraron samsung s6 y publicas hasta cuando cagas,ay si, te compraron samsung s6 y publicas hasta cuando cagas
96478,004,Bad Luck Brian,Va a votar Y se olvida su DNI,Va a votar Y, se olvida su DNI
96493,004,Bad Luck Brian,Otro Odiolieber publica tonteras Facebook lo bloquea 30 dias,Otro Odiolieber publica tonteras Facebook, lo bloquea 30 dias
96509,003,Ay Si,ay si el diablo anda suelto,ay si, el diablo anda suelto
96537,004,Bad Luck Brian,Se compra la botella mas cara del mundo le sale agua,Se compra la botella mas cara del mundo, le sale agua
96662,003,Ay Si,Hay si seme pasa,Hay si, seme pasa
96669,004,Bad Luck Brian,Que se siente que la profe te diga malcriado en tu cara,Que, se siente que la profe te diga malcriado en tu cara
96726,011,Problems,Cuando llegas a casa y ves que alguien se comio los tacos en los que estuviste pensando todo el dia,Cuando llegas a casa, y ves que alguien se comio los tacos en los que estuviste pensando todo el dia
96737,012,Willy Wonka,mañana empezaras a publicar en g+ dime que se siente decirlo todas las semanas,mañana empezaras a publicar en g+ ,dime que se siente decirlo todas las semanas
96743,003,Ay Si,ay si ay si yo no me meto con otros equipos,ay si ay si, yo no me meto con otros equipos
96793,012,Willy Wonka,asi que ir el primer dia de clases dime que se siente solo jugar,asi que ir el primer dia de clases ,dime que se siente solo jugar
96799,012,Willy Wonka,asi que dota 2 eh! dime que se siente que te puteen cada rato,asi que dota 2 eh! ,dime que se siente que te puteen cada rato
96800,003,Ay Si,Ay si ay si tengo pantalla nueva ya pa' que platico con los amigos,Ay si ay si, tengo pantalla nueva ya pa' que platico con los amigos
96839,004,Bad Luck Brian,se hace la epica no lo muestra,se hace la epica no, lo muestra
96936,003,Ay Si,hay si... yo no fui,hay si,... yo no fui
97158,007,Futurama Fry,no se si es una ardilla en chichi o una ardilla en tanga,no se si es una ardilla en chichi, o una ardilla en tanga
97198,012,Willy Wonka,asi que no eres geminis dime que se siente no ser chuchonaso,asi que no eres geminis ,dime que se siente no ser chuchonaso
97219,012,Willy Wonka,querias cambio en carlos piña dime que se siente,querias cambio en carlos piña ,dime que se siente
97224,003,Ay Si,ay si ahora todos se portaban bien,ay si, ahora todos se portaban bien
97240,007,Futurama Fry,no se si pasar a cantar sobrio o ebrio para no tener pena,no se si pasar a cantar sobrio, o ebrio para no tener pena
97289,003,Ay Si,ay si ay si tu visto me mata,ay si ay si, tu visto me mata
97300,003,Ay Si,hay si soy auditor,hay si, soy auditor
97313,011,Problems,Figueres Me dijo voy a Suiza y vuelvo rapido,Figueres Me dijo voy a Suiza, y vuelvo rapido
97319,011,Problems,es que no me e kedado extras y no tengo $,es que no me e kedado extras, y no tengo $
97356,003,Ay Si,ay si ay si excelente domingo y los demas llorando.... Pues si snif snif,ay si ay si, excelente domingo y los demas llorando.... Pues si snif snif
97398,003,Ay Si,"Ay si, hay si mi novio, mi novio",Ay si hay si, mi novio mi novio
97433,003,Ay Si,"Ay si, hay si voy a estudiar por que mañana tengo examen",Ay si hay si, voy a estudiar por que mañana tengo examen
97439,008,Matias Prats,ultima hora diana t estoy aburrido,ultima hora, diana t estoy aburrido
97530,006,Filosoraptor,Si mellizos se casan con mellizas ¿sus hijos seran iguales?,Si mellizos se casan con mellizas ,¿sus hijos seran iguales?
97571,008,Matias Prats,ultimas noticias muere hijo de tello,ultimas noticias, muere hijo de tello
97597,003,Ay Si,ay si yo armo la peda y luego les hecho la culpa,ay si, yo armo la peda y luego les hecho la culpa
97649,006,Filosoraptor,¿si iara es morena por que esta blanca? :v,,¿si iara es morena por que esta blanca? :v
97664,012,Willy Wonka,dime que se siente tener la visa aprobada,,dime que se siente tener la visa aprobada
97672,012,Willy Wonka,ASI QUE TE VAS DE PERMISO dime que se siente estar de rancho hasta el 30,ASI QUE TE VAS DE PERMISO ,dime que se siente estar de rancho hasta el 30
97715,004,Bad Luck Brian,sale de vacaciones le dejan tarea y tiene examenes entrando de todas las materias,sale de vacaciones, le dejan tarea y tiene examenes entrando de todas las materias
97722,004,Bad Luck Brian,va 75 a 0 su mama le da cablazo,va 75 a 0 su mama, le da cablazo
97726,004,Bad Luck Brian,habre 30 suministros raros solo le tocan simbolos y variantes de attachment,habre 30 suministros raros solo, le tocan simbolos y variantes de attachment
97819,004,Bad Luck Brian,su amor platonico lo lleva a curso no le toma ni la mano,su amor platonico, lo lleva a curso no le toma ni la mano
97922,011,Problems,Me deje el ordenador desbloqueado y acabe invitando a copas a toda la oficina,Me deje el ordenador desbloqueado, y acabe invitando a copas a toda la oficina
97959,007,Futurama Fry,si simsimi me secestra me violarara o me matara,si simsimi me secestra me violarara, o me matara
97962,007,Futurama Fry,si simsimi me secuestra? me viola o me mata?,si simsimi me secuestra? me viola, o me mata?
98128,003,Ay Si,"ay si, ay si me creo mucho por que despues de mil años metemos mas de dos goles",ay si ay si, me creo mucho por que despues de mil años metemos mas de dos goles
98129,011,Problems,"Invoque mi mounstruo y el saco fiber jarra :,v",Invoque mi mounstruo, y el saco fiber jarra :v
98144,012,Willy Wonka,"con que ganaron las chivas y ya ""se salvaron""... dime ¿que se siente saber que la proxima temporada aun estaran peleando el descenso?","con que ganaron las chivas y ya ""se salvaron""... ",dime ¿que se siente saber que la proxima temporada aun estaran peleando el descenso?
98210,003,Ay Si,"ay si, ay si va a traer su otro pj",ay si ay si, va a traer su otro pj
98276,003,Ay Si,Uy si uy si Omar me quiere quemar la casa,Uy si uy si, Omar me quiere quemar la casa
98288,004,Bad Luck Brian,quiere hacer  todo el trabajo mas eficiente y rapido lo hace mas lento y obsoleto,quiere hacer  todo el trabajo mas eficiente y rapido, lo hace mas lento y obsoleto
98289,003,Ay Si,ay si si es re feo,ay si, si es re feo
98304,003,Ay Si,Hay si si Ya le creimos Santos que abra tratado de paz,Hay si, si Ya le creimos Santos que abra tratado de paz
98317,012,Willy Wonka,"Oh, veo que estas haciendo un mazo mono rojo por favor, cuentame mas sobre tu habilidad para construir mazos",Oh veo que estas haciendo un mazo mono rojo por favor ,cuentame mas sobre tu habilidad para construir mazos
98332,012,Willy Wonka,dime que se siente no saber hacer pistols,,dime que se siente no saber hacer pistols
98337,003,Ay Si,ay si ahora todo es contra ti,ay si, ahora todo es contra ti
98342,003,Ay Si,hay si mi cafarena para mañana,hay si, mi cafarena para mañana
98365,003,Ay Si,"ay si, mi.mama me encontro en la mosca pero no soy de la martires ehh!!",ay si, mi.mama me encontro en la mosca pero no soy de la martires ehh!!
98367,003,Ay Si,ay si ay si esta enferma pero no quiere ir al medico,ay si ay si, esta enferma pero no quiere ir al medico
98406,012,Willy Wonka,Asi que no te gusta pagar impuestos dime que se siente hacer parte del escandalo de los papeles de panama,Asi que no te gusta pagar impuestos ,dime que se siente hacer parte del escandalo de los papeles de panama
98426,012,Willy Wonka,y dime que se siente que la cajera te vio la cara de pendejo,y ,dime que se siente que la cajera te vio la cara de pendejo
98427,003,Ay Si,Ay si ay si Corro mucho,Ay si ay si, Corro mucho
98457,008,Matias Prats,noticia de ultima hora me informan que chirley no es pita,noticia de ultima hora, me informan que chirley no es pita
98494,007,Futurama Fry,te aplaudo ? o quieres que me ria?,te aplaudo ?, o quieres que me ria?
98502,004,Bad Luck Brian,Le hace bullying Virginia Virginia lo cambia por alguien que le hace mas bullying,Le hace bullying Virginia Virginia, lo cambia por alguien que le hace mas bullying
98503,013,Yao Wonka,dime que se siente.? ser violado por un viejito,,dime que se siente.? ser violado por un viejito
98511,004,Bad Luck Brian,Le hace bullying a Virginia Virginia lo cambia por alguien que le hace mas bullying,Le hace bullying a Virginia Virginia, lo cambia por alguien que le hace mas bullying
98524,003,Ay Si,ay si darwin es gay le gusta hablar de hombres,ay si, darwin es gay le gusta hablar de hombres
98575,004,Bad Luck Brian,no se quiere enamorar de Dragon termina mas tragada que media de loco,no, se quiere enamorar de Dragon termina mas tragada que media de loco
98577,003,Ay Si,haysi hay si yo dario soy malote,haysi hay si, yo dario soy malote
98629,013,Yao Wonka,a si..... muy guapo cuentanos con que depilas tu cejas,a si..... muy guapo ,cuentanos con que depilas tu cejas
98713,003,Ay Si,Ay si ay si tengo novio y hasta los pedos le huelen bonito,Ay si ay si, tengo novio y hasta los pedos le huelen bonito
98720,003,Ay Si,Ay si  ay si casi llamo a los pacos,Ay si  ay si, casi llamo a los pacos
98732,012,Willy Wonka,Asi que llevas a ver coldplay a tu novia dime que sientes que te deje a las 2 semanas,Asi que llevas a ver coldplay a tu novia ,dime que sientes que te deje a las 2 semanas
98737,011,Problems,Me dijo que era el Medio burro yo pense que no sabia sumar y ahora no puedo ni sentarme,Me dijo que era el Medio burro yo pense que no sabia sumar, y ahora no puedo ni sentarme
98743,003,Ay Si,"ay si, ay si pensaba que ser representante era facil",ay si ay si, pensaba que ser representante era facil
98765,004,Bad Luck Brian,Quiere mostrar su nueva figura de star wars en una foto se olvida la figura y de llevar remera puesta,Quiere mostrar su nueva figura de star wars en una foto, se olvida la figura y de llevar remera puesta
98781,011,Problems,me dolio por atras y sin saliva,me dolio por atras, y sin saliva
98791,004,Bad Luck Brian,Le dice que le gusta los juguetes Le lleva un muñeco de dragon ball z,Le dice que, le gusta los juguetes Le lleva un muñeco de dragon ball z
98937,013,Yao Wonka,asi que tuviste un buen fin de semana con los primos eh dime que se siente ir develada a trabajar en lunes,asi que tuviste un buen fin de semana con los primos eh ,dime que se siente ir develada a trabajar en lunes
98975,012,Willy Wonka,cuentame que tiene que ver que seamos hermanos JONA,,cuentame que tiene que ver que seamos hermanos JONA
99013,012,Willy Wonka,asi q eres hincha del c45i y dime q se siente vivir resentido con losbtitulos del rojo,asi q eres hincha del c45i y ,dime q se siente vivir resentido con losbtitulos del rojo
99014,012,Willy Wonka,asi q eres hincha del c45i y dime q se siente vivir frustrado con los titulos del rojo,asi q eres hincha del c45i y ,dime q se siente vivir frustrado con los titulos del rojo
99016,012,Willy Wonka,asi q eres hincha del c45i y dime q se siente vivir frustrado x los titulos del rojo,asi q eres hincha del c45i y ,dime q se siente vivir frustrado x los titulos del rojo
99047,004,Bad Luck Brian,Soy eddy y no se porque Pago taxi y me voy a pie.,Soy eddy y no, se porque Pago taxi y me voy a pie.
99080,003,Ay Si,uy si uy si me llevo y no me aguanto,uy si uy si, me llevo y no me aguanto
99113,003,Ay Si,Soy hector el bueno..ay siiii,Soy hector el bueno..ay si,iii
99116,006,Filosoraptor,¿QUE HACE JAKE EN MATEMÁTICAS? JAKEMATE,,¿QUE HACE JAKE EN MATEMÁTICAS? JAKEMATE
99121,003,Ay Si,ay si ay si Ahora pedile a magoya q te arregle las multas,ay si ay si, Ahora pedile a magoya q te arregle las multas
99225,004,Bad Luck Brian,se quiere tatuar una chala le tatuan una margarita,se quiere tatuar una chala, le tatuan una margarita
99233,006,Filosoraptor,Si vienes a biblio y no te hablan de politica ¿realmente viniste a biblio?,Si vienes a biblio y no te hablan de politica ,¿realmente viniste a biblio?
99247,007,Futurama Fry,No se si es to the stage o we'll be ok,No se si es to the stage, o we'll be ok
99288,004,Bad Luck Brian,Va al teatro Y Aristoteles le dice morboso,Va al teatro Y Aristoteles, le dice morboso
99336,003,Ay Si,ay ay si ahora se ace el ofendido,ay ay si, ahora se ace el ofendido
99408,008,Matias Prats,"ultima hora venga pajaro, me voy al catre que mañana madrugo, ya me comes los morros otro dia, si eso",ultima hora, venga pajaro me voy al catre que mañana madrugo ya me comes los morros otro dia si eso
99419,003,Ay Si,"Ay si, ay si Corriges a tu profesora de castellano y te crees licenciado.",Ay si ay si, Corriges a tu profesora de castellano y te crees licenciado.
99425,003,Ay Si,"Hay si, montas la de santa Y en italia eras puro marroneo",Hay si, montas la de santa Y en italia eras puro marroneo
99432,006,Filosoraptor,si es contador y no hace la declaracion ¿que clase de contador es?,si es contador y no hace la declaracion ,¿que clase de contador es?
99439,007,Futurama Fry,yorkelina tu estas enamorada de mi o es mi imaginacion,yorkelina tu estas enamorada de mi, o es mi imaginacion
99449,012,Willy Wonka,dime mime que se siente jalarsela,,dime mime que se siente jalarsela
99614,012,Willy Wonka,VIVIANA dime que se siente ser la ninfomana mas depravada de todo Colombia,VIVIANA ,dime que se siente ser la ninfomana mas depravada de todo Colombia
99631,011,Problems,eN CLASES DE BOXEO SIEMPRE ME ESCOgEN DE LOS PRIMEROS COMO PAREJA Y yo solo quiero quedar solo para practicar con el profe y que me corrija tecnica,eN CLASES DE BOXEO SIEMPRE ME ESCOgEN DE LOS PRIMEROS COMO PAREJA Y yo solo quiero quedar solo para practicar con el profe, y que me corrija tecnica
99659,003,Ay Si,ay si ay si ya se enojo,ay si ay si, ya se enojo
99666,007,Futurama Fry,sera que es demasiado amable o esta coqueteando?,sera que es demasiado amable, o esta coqueteando?
99705,012,Willy Wonka,asi que trabajas en sumitrag dime que se siente que no te paguen,asi que trabajas en sumitrag ,dime que se siente que no te paguen
99746,004,Bad Luck Brian,sube un video orgulloso lo sancionan por c,sube un video orgulloso, lo sancionan por c
99793,003,Ay Si,"hay si, hay yo ya los tengo!",hay si, hay yo ya los tengo!
99796,003,Ay Si,"ay si, ay yo ya los tengo!",ay si, ay yo ya los tengo!
99798,003,Ay Si,"ay si, ay si yo ya los tengo!",ay si ay si, yo ya los tengo!
