,meme_id,plantilla,texto_no_tilde,text_1,text_2
146029,004,Bad Luck Brian,odian a paco fevans le dedican estados,odian a paco fevans, le dedican estados
146033,004,Bad Luck Brian,Odian a pacofevans le dedican estados,Odian a pacofevans, le dedican estados
146073,012,Willy Wonka,Y dime que se siente que yo si crea en El Salvador,Y ,dime que se siente que yo si crea en El Salvador
146111,012,Willy Wonka,asi que eres fan de sofia carson dime que se siente amar a la mujer mas linda de disney,asi que eres fan de sofia carson ,dime que se siente amar a la mujer mas linda de disney
146149,003,Ay Si,ay si nomas le gano a terry y me regreso a chihuas,ay si, nomas le gano a terry y me regreso a chihuas
146283,004,Bad Luck Brian,calderon limpiate el diente y lo sabes feooo,calderon limpiate el diente y, lo sabes feooo
146321,004,Bad Luck Brian,le pasan las llaves para abrir antes se queda dormida,le pasan las llaves para abrir antes, se queda dormida
146330,012,Willy Wonka,dime que se siente tener puros 7 y no saber nada de tu carrera,,dime que se siente tener puros 7 y no saber nada de tu carrera
146340,012,Willy Wonka,asi que eres universitario dime que se siente no tener fin de semana libre?,asi que eres universitario ,dime que se siente no tener fin de semana libre?
146369,007,Futurama Fry,no recuerdo si se pronuncia deivid o dAIVID,no recuerdo si se pronuncia deivid, o dAIVID
146451,012,Willy Wonka,asi que te gusta humor guajiro y dime ¿que se siente hacer parte de la mejor pagina de humor?,asi que te gusta humor guajiro y ,dime ¿que se siente hacer parte de la mejor pagina de humor?
146517,006,Filosoraptor,si la delincuencia esta cada vez peor ¿por que sigues votando por los mismos?,si la delincuencia esta cada vez peor ,¿por que sigues votando por los mismos?
146529,010,Prepare Yourself,preparense el tronco se repostula,preparense, el tronco se repostula
146566,004,Bad Luck Brian,ejecuta query Jira se bloquea,ejecuta query Jira, se bloquea
146568,004,Bad Luck Brian,se prepara su desayuno para llevar lo deja en su casa,se prepara su desayuno para llevar, lo deja en su casa
146572,010,Prepare Yourself,preparense biblias y rezos por monton,preparense, biblias y rezos por monton
146612,012,Willy Wonka,asi q no tienes tiempo para ir a hs? dime que se siente no ir a visitar a quien tanto te ama,asi q no tienes tiempo para ir a hs? ,dime que se siente no ir a visitar a quien tanto te ama
146613,012,Willy Wonka,"asi que ya quedaste en el tec, pus felicidades dime que se siente saber que de ahora en adelante sufriras",asi que ya quedaste en el tec pus felicidades ,dime que se siente saber que de ahora en adelante sufriras
146616,004,Bad Luck Brian,dice fuck you a todos... su iphone 6 se lo dice con la grieta de la pantalla todos los dias...,dice fuck you a todos... su iphone 6, se lo dice con la grieta de la pantalla todos los dias...
146656,003,Ay Si,"aY si, ay si me gusta tanto el blackmetal underground que me la paso publicando bandas en facebook... y les agrego un corazoncito",aY si ay si, me gusta tanto el blackmetal underground que me la paso publicando bandas en facebook... y les agrego un corazoncito
146657,003,Ay Si,"ay si, ay si..... voy de rojo, para que no me ojeen.....",ay si ay si,..... voy de rojo para que no me ojeen.....
146665,012,Willy Wonka,"cuentame que se siente ser developer de google si, de google search",,cuentame que se siente ser developer de google si de google search
146791,011,Problems,Fui violada de niña y Mi hija alejandra tambien fue violada x su padrasto,Fui violada de niña, y Mi hija alejandra tambien fue violada x su padrasto
146809,010,Prepare Yourself,preparense SE ACERCAN LOS IMPUESTOS URUGUAYOS,preparense, SE ACERCAN LOS IMPUESTOS URUGUAYOS
146849,004,Bad Luck Brian,le dijo a las mujeres que era morboso ellas le dijeron que solo quieren caballeros,le dijo a las mujeres que era morboso ellas, le dijeron que solo quieren caballeros
146859,007,Futurama Fry,No se si es en serio o me estas chingado,No se si es en serio, o me estas chingado
146863,004,Bad Luck Brian,Ya le pago Se demora un año,Ya, le pago Se demora un año
146870,012,Willy Wonka,y dime ¿que se siente contaminar? y aun decir que tienes mucha cultura,y ,dime ¿que se siente contaminar? y aun decir que tienes mucha cultura
146879,007,Futurama Fry,Esta  DESPerado o NADIEn  le hace casos,Esta  DESPerado, o NADIEn  le hace casos
146881,007,Futurama Fry,No se si esta desesperado o nadie le hace caso,No se si esta desesperado, o nadie le hace caso
146882,013,Yao Wonka,dime Johnny q se siente saber q eres del equipo d los maricones azules,,dime Johnny q se siente saber q eres del equipo d los maricones azules
146897,012,Willy Wonka,asi que  estas desperado dime que se siente que tu amigos te avandone,asi que  estas desperado ,dime que se siente que tu amigos te avandone
146901,004,Bad Luck Brian,Lo violaron y le gusto,Lo violaron y, le gusto
146907,012,Willy Wonka,Ahora dime Stiven Que se siente andar en una apache a 150 k/h,Ahora ,dime Stiven Que se siente andar en una apache a 150 k/h
146936,007,Futurama Fry,"recuerda preguntarle al cliente si quiere validar o no los datos si responde que si, no olvides la caracteristica del telefono",recuerda preguntarle al cliente si quiere validar, o no los datos si responde que si no olvides la caracteristica del telefono
146940,003,Ay Si,Ay si ay si soy el trompas Y me la como toda,Ay si ay si, soy el trompas Y me la como toda
146989,012,Willy Wonka,Ahora dime que se siente Ser ardido y no tener crema para untar,Ahora ,dime que se siente Ser ardido y no tener crema para untar
146990,012,Willy Wonka,Ahora dime que se siente Ser ardido y no tener crema para untarse,Ahora ,dime que se siente Ser ardido y no tener crema para untarse
147021,004,Bad Luck Brian,Ofrece pizza Se le quema,Ofrece pizza Se, le quema
147099,004,Bad Luck Brian,Hace un video porno Se le duerme,Hace un video porno Se, le duerme
147114,011,Problems,Y hoy te marchas de mi lado con otro querer y asi yo vivo mi vida: herida,Y hoy te marchas de mi lado con otro querer, y asi yo vivo mi vida: herida
147147,004,Bad Luck Brian,Lo convocan al partido vs San Ramon Lo meten solo porque se lesiona alguien y al minuto despues termina el partido,Lo convocan al partido vs San Ramon Lo meten solo porque, se lesiona alguien y al minuto despues termina el partido
147149,003,Ay Si,ay si y que quieres que haga?,ay si, y que quieres que haga?
147151,004,Bad Luck Brian,no se te kita lo pendejo,no se te kita, lo pendejo
147154,004,Bad Luck Brian,Llega diciendo que es de concepcion se resfrIa en santiago,Llega diciendo que es de concepcion, se resfrIa en santiago
147182,011,Problems,todavia quedan 4 dias y todavia me duele la garganta,todavia quedan 4 dias, y todavia me duele la garganta
147204,003,Ay Si,ay si ay si es que la gente es chismosa ponte a trabajar y nadie hablara de ti,ay si ay si, es que la gente es chismosa ponte a trabajar y nadie hablara de ti
147208,008,Matias Prats,noticias  d  ultima hora carlos  se  va  a  bañar,noticias  d  ultima hora, carlos  se  va  a  bañar
147232,011,Problems,Me pide todo apurado y despues ni responde los correos,Me pide todo apurado, y despues ni responde los correos
147237,011,Problems,me pide todo apurado y depues ni responde los mails,me pide todo apurado, y depues ni responde los mails
147296,011,Problems,Le puse una reunion y paso de mi...,Le puse una reunion, y paso de mi...
147302,008,Matias Prats,ultima hora ese tal numero no existe,ultima hora, ese tal numero no existe
147319,004,Bad Luck Brian,Crea una cuenta falsa para trollear a favor de keiko todos lo trollean,Crea una cuenta falsa para trollear a favor de keiko todos, lo trollean
147339,010,Prepare Yourself,preparense tropas los solitarios ingenieros se agrupan,preparense, tropas los solitarios ingenieros se agrupan
147461,008,Matias Prats,Noticia de ultima hora el Sñ. Miguel Peñarreta a confensado que esta enamorado de la Sñrt. Sugey Nicole,Noticia de ultima hora, el Sñ. Miguel Peñarreta a confensado que esta enamorado de la Sñrt. Sugey Nicole
147466,011,Problems,Y luego chessman dijo La repo viene del 1er y 2do parcial,Y luego chessman dijo La repo viene del 1er, y 2do parcial
147541,012,Willy Wonka,MESSI dime q se siente ser gay,MESSI ,dime q se siente ser gay
147594,003,Ay Si,ay si ay si voy invicta,ay si ay si, voy invicta
147616,004,Bad Luck Brian,Cree que explico todo bien no se entiende ninguna wa,Cree que explico todo bien no, se entiende ninguna wa
147621,004,Bad Luck Brian,Cree que explico todo bien ni siquiera el lo entiende,Cree que explico todo bien ni siquiera el, lo entiende
147647,004,Bad Luck Brian,lA vida le dio limones se entoxico porque esban podridos,lA vida, le dio limones se entoxico porque esban podridos
147660,004,Bad Luck Brian,Donde esta mi amor Aaa ya se esta trabajando,Donde esta mi amor Aaa ya, se esta trabajando
147670,006,Filosoraptor,SI LOS DINOSAURIOS SE EXTINGUIERON ¿PORQUE EXISTE BARNEY?,SI LOS DINOSAURIOS SE EXTINGUIERON ,¿PORQUE EXISTE BARNEY?
147687,003,Ay Si,¡Ay si ay si! Ya abrieron el ched,¡Ay si ay si,! Ya abrieron el ched
147688,004,Bad Luck Brian,usa todo su epp se accidenta porque no siguio los procedimientos,usa todo su epp, se accidenta porque no siguio los procedimientos
147705,012,Willy Wonka,asi q te sientes mexicana sugey dime que se siente nacer y vivir en colombia jajajaja,asi q te sientes mexicana sugey ,dime que se siente nacer y vivir en colombia jajajaja
147710,006,Filosoraptor,en los examen de orina ¿ por que no hay que estudiar ?,en los examen de orina ,¿ por que no hay que estudiar ?
147725,007,Futurama Fry,no se si estoy medio despierto o medio dormido,no se si estoy medio despierto, o medio dormido
147727,012,Willy Wonka,dime k se siente estar en el mejor famdom,,dime k se siente estar en el mejor famdom
147746,012,Willy Wonka,¿Con que tienes examen? cuentame como te va si no entraste todo el semestre,¿Con que tienes examen? ,cuentame como te va si no entraste todo el semestre
147786,011,Problems,y entonces no me los quize tragar y por eso nacio el pendejete del zea,y entonces no me los quize tragar, y por eso nacio el pendejete del zea
147800,007,Futurama Fry,no se si eres tonto o muy tonto,no se si eres tonto, o muy tonto
147840,006,Filosoraptor,y si van a trabajar solo lunes y martes... ¿para cuando las vacaciones?,y si van a trabajar solo lunes y martes... ,¿para cuando las vacaciones?
147852,012,Willy Wonka,¿Iras al katana tour? dime que se siente obtener increibles descuentos,¿Iras al katana tour? ,dime que se siente obtener increibles descuentos
147868,004,Bad Luck Brian,monta una fabrica de hielo... se le quema,monta una fabrica de hielo..., se le quema
147890,003,Ay Si,ay si tu ya me vite? o me andas espiando,ay si, tu ya me vite? o me andas espiando
147893,003,Ay Si,ay si tu ya me viste? o me andas espiando,ay si, tu ya me viste? o me andas espiando
147915,004,Bad Luck Brian,crea un grupo de chistes geeks se convierte en un foro de soporte tecnico,crea un grupo de chistes geeks, se convierte en un foro de soporte tecnico
147922,004,Bad Luck Brian,crea un grupo geek con sus amigos se convierte en un foro de soporte tecnico,crea un grupo geek con sus amigos, se convierte en un foro de soporte tecnico
147946,003,Ay Si,"Ay si, ay si Como ya bese a erika ya me siento hOMBRE",Ay si ay si, Como ya bese a erika ya me siento hOMBRE
147999,003,Ay Si,Sabe separar el papel Ay si     ay si,Sabe separar el papel Ay si     ay si,
148003,003,Ay Si,Sabe separar el papel Ay si ay si,Sabe separar el papel Ay si ay si,
148043,004,Bad Luck Brian,intenta ser pesado se equivoca y le sale mal,intenta ser pesado se equivoca y, le sale mal
148136,003,Ay Si,"Ay si , ay si Mi publicacion",Ay si  ay si, Mi publicacion
148156,003,Ay Si,ay si ay ahora todos publican que hace frio,ay si, ay ahora todos publican que hace frio
148198,004,Bad Luck Brian,se compra un pc nuevo algo falla y le da un ataque electrico,se compra un pc nuevo algo falla y, le da un ataque electrico
148320,003,Ay Si,Ay si ay si Enserio,Ay si ay si, Enserio
148330,003,Ay Si,Hay si ahora  resulta que los hombres son fieles No te mordiste la lengua,Hay si, ahora  resulta que los hombres son fieles No te mordiste la lengua
148368,007,Futurama Fry,no se si dejarte en visto o responderte para que no te molestes xD,no se si dejarte en visto, o responderte para que no te molestes xD
148382,012,Willy Wonka,"dices que  procrastinar no es malo? dime, que se siente dejar el trabajo para ultima hora",dices que  procrastinar no es malo? ,dime que se siente dejar el trabajo para ultima hora
148405,012,Willy Wonka,dime que se siente que me haya llevado al pajero,,dime que se siente que me haya llevado al pajero
148416,004,Bad Luck Brian,saca tarjeta por primera vez se la clonan,saca tarjeta por primera vez, se la clonan
148480,012,Willy Wonka,asi que quieres ser el nº 1 del curso dime que se siente haber faltado al examen sorpresa,asi que quieres ser el nº 1 del curso ,dime que se siente haber faltado al examen sorpresa
148481,011,Problems,A veces me dan ganas de correr a mi marido Pero me acuerdo que me mantiene y se me pasa,A veces me dan ganas de correr a mi marido Pero me acuerdo que me mantiene, y se me pasa
148495,011,Problems,Me dijo que solo era un ratito... Las dos y media de la mañana en guerra todavia!!!,Me dijo que solo era un ratito... Las dos, y media de la mañana en guerra todavia!!!
148514,004,Bad Luck Brian,jugar un VÍDEO juego todo el dia al dia siguente se entera que no guardo la partida,jugar un VÍDEO juego todo el dia al dia siguente, se entera que no guardo la partida
148796,003,Ay Si,ay si AY SI TODOS EMOCIONADOS POR LA NX Y POR EL NUEVO TLOZ,ay si, AY SI TODOS EMOCIONADOS POR LA NX Y POR EL NUEVO TLOZ
148799,003,Ay Si,ay si AY SI TODOS EMOCIONADOS POR LA NX Y POR EL NUEVO TLOZ Y NO TIENEN PARA UN CHICLE,ay si, AY SI TODOS EMOCIONADOS POR LA NX Y POR EL NUEVO TLOZ Y NO TIENEN PARA UN CHICLE
148832,003,Ay Si,Ay si... ay si... la policia no nos desaloja....,Ay si... ay si,... la policia no nos desaloja....
148899,007,Futurama Fry,Tengo una duda Cali es muy malo o nacional es un equipaso,Tengo una duda Cali es muy malo, o nacional es un equipaso
148939,012,Willy Wonka,con que saliste a carretear dime que se siente no terminar el informe,con que saliste a carretear ,dime que se siente no terminar el informe
148954,003,Ay Si,Ay si ay si.!! No me gusta leer,Ay si ay si,.!! No me gusta leer
148996,003,Ay Si,ay si gran vaina ya recojimos las firmas y ya creen que ganaron la presidencia,ay si, gran vaina ya recojimos las firmas y ya creen que ganaron la presidencia
149035,006,Filosoraptor,¿po que los musicos dicen 1 2 3 4 y los bailarines 5 6 7 8?,,¿po que los musicos dicen 1 2 3 4 y los bailarines 5 6 7 8?
149048,013,Yao Wonka,ya no escribes te quedaste sin argumentos dime que se siente que goku casi muere por una bala por asi decirlo,ya no escribes te quedaste sin argumentos ,dime que se siente que goku casi muere por una bala por asi decirlo
149057,007,Futurama Fry,oh gallo es mentirozo o gallardo esta siego,oh gallo es mentirozo, o gallardo esta siego
149118,011,Problems,Lo hice enojar y el... Golpeo a mi peito,Lo hice enojar, y el... Golpeo a mi peito
149119,003,Ay Si,ay si ay si un pinguino me matara,ay si ay si, un pinguino me matara
149131,012,Willy Wonka,asi que te gusta momoiro clover z dime que se siente que nunca ira a tu pais,asi que te gusta momoiro clover z ,dime que se siente que nunca ira a tu pais
149159,003,Ay Si,ay si maldito joto te gusta la de miar,ay si, maldito joto te gusta la de miar
149206,003,Ay Si,"Ay si, ay si Que calor",Ay si ay si, Que calor
149243,012,Willy Wonka,asi que eres gordo dime que se siente que te comparen com mayo,asi que eres gordo ,dime que se siente que te comparen com mayo
149258,012,Willy Wonka,asi que eres gordo dime que se siente que te comparen con mayo,asi que eres gordo ,dime que se siente que te comparen con mayo
149261,012,Willy Wonka,¿asi que eres registradora de familia? dime que se siente que tus auxiliares te pregunten seis veces en un dia como se escribe Stephanie?,¿asi que eres registradora de familia? ,dime que se siente que tus auxiliares te pregunten seis veces en un dia como se escribe Stephanie?
149336,004,Bad Luck Brian,Cuenta un chiste y todos se enojan,Cuenta un chiste y todos, se enojan
149377,012,Willy Wonka,"Asi que repudias a #lady100pesos y ensalzas a #LadyMatematicas Es justo, pero dime, ¿cuando fue la ultima vez que agarraste un libro de matematicas y cuando la ultima que te fuiste de peda?",Asi que repudias a #lady100pesos y ensalzas a #LadyMatematicas Es justo pero ,dime ¿cuando fue la ultima vez que agarraste un libro de matematicas y cuando la ultima que te fuiste de peda?
149414,012,Willy Wonka,dime que se siente SABER que el barrio te respalda,,dime que se siente SABER que el barrio te respalda
149422,012,Willy Wonka,dime que se siente que te quieras reir de algo que dijo con el q no te hablas,,dime que se siente que te quieras reir de algo que dijo con el q no te hablas
149423,004,Bad Luck Brian,Critica a las personas por usar muchos filtros en sus fotos Ella tambien lo hace :v,Critica a las personas por usar muchos filtros en sus fotos Ella tambien, lo hace :v
149437,004,Bad Luck Brian,Presenta un Cv con documentos falsos para impresionar En la entrevista le piden los originales,Presenta un Cv con documentos falsos para impresionar En la entrevista, le piden los originales
149439,004,Bad Luck Brian,Presenta un Cv con documentos falsos y en copia para impresionar En la entrevista le piden los originales para corroborar.,Presenta un Cv con documentos falsos y en copia para impresionar En la entrevista, le piden los originales para corroborar.
149471,007,Futurama Fry,No se si eres la mujer mas bella o la mujer mas extraordinaria,No se si eres la mujer mas bella, o la mujer mas extraordinaria
149475,012,Willy Wonka,con que quieres que sea perfecta dime que se siente decepcionarte?,con que quieres que sea perfecta ,dime que se siente decepcionarte?
149483,003,Ay Si,"Ay si, ay si! cuando es para guerras civiles si es importante el negro o mulato, pero para decisiones POLÍTICAS e igualdad de derechos no se tiene en cuenta",Ay si ay si,! cuando es para guerras civiles si es importante el negro o mulato pero para decisiones POLÍTICAS e igualdad de derechos no se tiene en cuenta
149490,003,Ay Si,Hay si!! En algun lugar por ahi,Hay si,!! En algun lugar por ahi
149496,003,Ay Si,Hay si!! En algun lugar la mamada,Hay si,!! En algun lugar la mamada
149525,004,Bad Luck Brian,Se hace pentakill Pero se va la luz,Se hace pentakill Pero, se va la luz
149572,011,Problems,fue amable me dijo hola tio y luego me metio 20 puntos,fue amable me dijo hola tio, y luego me metio 20 puntos
149592,004,Bad Luck Brian,se va a la tienda de videojuegos se va a disneylandia,se va a la tienda de videojuegos, se va a disneylandia
149594,004,Bad Luck Brian,"busca ""jhon cena"" le sale un meme sobrevalorado","busca ""jhon cena""", le sale un meme sobrevalorado
149595,004,Bad Luck Brian,se le ocurre un meme se le va de las manos,se le ocurre un meme, se le va de las manos
149598,004,Bad Luck Brian,se acaba the evil within en la dificultad mas alta se le borran los datos,se acaba the evil within en la dificultad mas alta, se le borran los datos
149599,004,Bad Luck Brian,se va a la escuela se pierde,se va a la escuela, se pierde
149601,004,Bad Luck Brian,para con los memes de bad luck brian se crea otro,para con los memes de bad luck brian, se crea otro
149633,006,Filosoraptor,"¿Nahuel quiere matar a Tadeo, Pato y Nery? Bueno, espero que este a la altura...",,¿Nahuel quiere matar a Tadeo Pato y Nery? Bueno espero que este a la altura...
149652,011,Problems,me dijo que solo iria un rato con los stil y regreso bien pedo,me dijo que solo iria un rato con los stil, y regreso bien pedo
149674,004,Bad Luck Brian,¿Si un mero se encuentra con Cardona? ¿Sera mera coincidencia?,¿Si un mero, se encuentra con Cardona? ¿Sera mera coincidencia?
149747,012,Willy Wonka,y dime que se siente que te diga que no y corres a escribir para ver quien cae,y ,dime que se siente que te diga que no y corres a escribir para ver quien cae
149758,003,Ay Si,Hay si ahora y estan dormidos,Hay si, ahora y estan dormidos
149781,007,Futurama Fry,No se si jesus vive o Si muere,No se si jesus vive, o Si muere
149862,012,Willy Wonka,cuentame mas,,cuentame mas
149917,004,Bad Luck Brian,Deja su numero de cuenta Nadie le deposita,Deja su numero de cuenta Nadie, le deposita
149945,004,Bad Luck Brian,Hace todo lo posible pa que lo echen le ponen mas trabajo,Hace todo lo posible pa que lo echen, le ponen mas trabajo
149997,005,Disaster Girl,alli vivia el que expropiaba dejaba robar a los ministros y a las comunas alli vivia,alli vivia el que expropiaba dejaba robar a los ministros y a las comunas alli ,vivia
150008,011,Problems,me dijo que iba a navegar despues de las 10pm luego recorde que soy movilnet y supe que estoy en alto consumo,me dijo que iba a navegar despues de las 10pm luego recorde que soy movilnet, y supe que estoy en alto consumo
150026,007,Futurama Fry,No se si la materia es muy dificil o yo soy muy tonto,No se si la materia es muy dificil, o yo soy muy tonto
150046,012,Willy Wonka,Asi que eres mi cuñado dime ¿que se siente tener la mejor cuñada del mundo?,Asi que eres mi cuñado ,dime ¿que se siente tener la mejor cuñada del mundo?
150055,004,Bad Luck Brian,abril le dice a elias que lo quiere y elias la manda a la #%34&#$&,abril le dice a elias que, lo quiere y elias la manda a la #%34&#$&
150083,007,Futurama Fry,No se si soy muy mateo o la asignatura es muy facil,No se si soy muy mateo, o la asignatura es muy facil
150087,010,Prepare Yourself,ptm  preparense gente subiendo fotos de cuando eran niños 3.2.1  a castrar,ptm  preparense, gente subiendo fotos de cuando eran niños 3.2.1  a castrar
150104,003,Ay Si,ay si! ahora todos trabajan,ay si,! ahora todos trabajan
150140,012,Willy Wonka,"asi que te HICISTE tu practica de TEocom y te esforzaste dime que se siente ser  rechazado por el interlineado, el formato de hoja y la caratula",asi que te HICISTE tu practica de TEocom y te esforzaste ,dime que se siente ser  rechazado por el interlineado el formato de hoja y la caratula
150154,004,Bad Luck Brian,es una seresa se cree tarantino,es una seresa, se cree tarantino
150200,003,Ay Si,"Ay si, ay si.... Ahora Tere y yo ya somos amigas...",Ay si ay si,.... Ahora Tere y yo ya somos amigas...
150222,012,Willy Wonka,dime que se siente no dar niuna en la U,,dime que se siente no dar niuna en la U
150238,003,Ay Si,ay si veo civil war,ay si, veo civil war
150249,006,Filosoraptor,si el aereopuerto es seguro ¿Porque le dicen terminal?,si el aereopuerto es seguro ,¿Porque le dicen terminal?
150401,004,Bad Luck Brian,no se quiere quedar a los cortos de civil war los cortos son antes de la pelicula,no, se quiere quedar a los cortos de civil war los cortos son antes de la pelicula
150423,012,Willy Wonka,asi que te  crees mucho por fumar dime que siente ser un inmaduro,asi que te  crees mucho por fumar ,dime que siente ser un inmaduro
150434,012,Willy Wonka,cuentame que se siente darte cuenta que los tios son mas inteligentes que las tias??,,cuentame que se siente darte cuenta que los tios son mas inteligentes que las tias??
150458,008,Matias Prats,En ultimas noticias Migel ya no es de este grupo,En ultimas noticias, Migel ya no es de este grupo
150487,008,Matias Prats,noticia de ultima hora es fin de mes y aun falta para que paguen,noticia de ultima hora, es fin de mes y aun falta para que paguen
150488,012,Willy Wonka,asi que no sabes trapear dime que se siente no servirle a julion alvarez,asi que no sabes trapear ,dime que se siente no servirle a julion alvarez
150527,003,Ay Si,Ay si ay si celebramos el dia del intenet,Ay si ay si, celebramos el dia del intenet
150552,008,Matias Prats,¡¡ultimas noticias!! Eljoni es alto gobernado que ni contesta xD,¡¡ultimas noticias,!! Eljoni es alto gobernado que ni contesta xD
150566,003,Ay Si,Ay si ay si Con lentes estoy divino,Ay si ay si, Con lentes estoy divino
150579,007,Futurama Fry,no se si es Buchi o iggy pop,no se si es Buchi, o iggy pop
150635,008,Matias Prats,hoy en la ultima hora aun no en cuentran al chiste perdido,hoy en la ultima hora, aun no en cuentran al chiste perdido
150697,010,Prepare Yourself,"preparense mucha se viene aquel monton, pidiendo likes para concursos del dia de la madre",preparense, mucha se viene aquel monton pidiendo likes para concursos del dia de la madre
150698,007,Futurama Fry,no se si he visto un buen kick de cookies o ha sido una ilusion,no se si he visto un buen kick de cookies, o ha sido una ilusion
150789,007,Futurama Fry,novia o amigos,novia, o amigos
150827,006,Filosoraptor,si el que llora es un lloron ¿el que lee es un leon?,si el que llora es un lloron ,¿el que lee es un leon?
150906,006,Filosoraptor,¿Quien sera El... ultimo?,,¿Quien sera El... ultimo?
150907,011,Problems,Como cuando te acuerdas que dejaron tarea y es domimgo,Como cuando te acuerdas que dejaron tarea, y es domimgo
150952,004,Bad Luck Brian,hace una investigacion profunda para refutar el cristianismo se hace cristiano,hace una investigacion profunda para refutar el cristianismo, se hace cristiano
150978,012,Willy Wonka,asi que envias solicitud de amistad a todo el mundo! dime que se siente llevar tu vida sin ningun tipo de sentido social?,asi que envias solicitud de amistad a todo el mundo! ,dime que se siente llevar tu vida sin ningun tipo de sentido social?
150984,006,Filosoraptor,¿SI CRUEL ES BUENO HACER EL BIEN ES CRUEL?,,¿SI CRUEL ES BUENO HACER EL BIEN ES CRUEL?
150999,004,Bad Luck Brian,Got7 tiene su primer concierto se lesiona otra vez,Got7 tiene su primer concierto, se lesiona otra vez
