,meme_id,plantilla,texto_no_tilde,text_1,text_2
42436,003,Ay Si,ay si se la tira de la asiadita y ni a frijoles chocos llega,ay si, se la tira de la asiadita y ni a frijoles chocos llega
42437,004,Bad Luck Brian,TIpico compra un sacapuntas nuevo se lo queman el primer dia,TIpico compra un sacapuntas nuevo, se lo queman el primer dia
42484,010,Prepare Yourself,preparense... Ya vienen los spoilers de Batman v Superman,preparense,... Ya vienen los spoilers de Batman v Superman
42544,012,Willy Wonka,Y dime que se siente armar el cubo de rubik Con tutoriales,Y ,dime que se siente armar el cubo de rubik Con tutoriales
42546,012,Willy Wonka,"Y cuentame, que se sienta esperar Tres años vender la casa.. Y que falte un papel..cuando lo logras!!",Y ,cuentame que se sienta esperar Tres años vender la casa.. Y que falte un papel..cuando lo logras!!
42552,012,Willy Wonka,Y cuentame..que se siente esperar tres años un cliente y perderlo Porque falta un papel?,Y ,cuentame..que se siente esperar tres años un cliente y perderlo Porque falta un papel?
42575,004,Bad Luck Brian,asegura que su equipo sera campeon le da miedo apostar,asegura que su equipo sera campeon, le da miedo apostar
42584,003,Ay Si,Ay si ay si... todas dicen feliz dia del hombre pero en la noche uno es que paga la moteliada. Chichipatosas!,Ay si ay si,... todas dicen feliz dia del hombre pero en la noche uno es que paga la moteliada. Chichipatosas!
42623,012,Willy Wonka,"dime correa ¿que se siente defender  los intereses de tu jefes los Eljuri, con esto de bajar  las horas laborables y joder a todo el ecuador  ?",,dime correa ¿que se siente defender  los intereses de tu jefes los Eljuri con esto de bajar  las horas laborables y joder a todo el ecuador  ?
42631,004,Bad Luck Brian,no tiene rivales dice se caga cuando le apuestan,no tiene rivales dice se caga cuando, le apuestan
42664,012,Willy Wonka,y aver dime quien es cristiano ?,y aver ,dime quien es cristiano ?
42668,012,Willy Wonka,oie oie diana cuentame !!,oie oie diana ,cuentame !!
42694,007,Futurama Fry,tu....... eres hombre o maricon,tu....... eres hombre, o maricon
42696,004,Bad Luck Brian,Saca porfin la licencia de conducir Se le hecha a perder el auto,Saca porfin la licencia de conducir Se, le hecha a perder el auto
42760,003,Ay Si,"Ay si, ay si ya me voy",Ay si ay si, ya me voy
42770,004,Bad Luck Brian,hace un proyectode fl studio se malogra su pc,hace un proyectode fl studio, se malogra su pc
42804,003,Ay Si,"uy si, tomo foto casual y de paso enseño cuerpo",uy si, tomo foto casual y de paso enseño cuerpo
42805,004,Bad Luck Brian,Quiere declararsela se cruzan sus papas,Quiere declararsela, se cruzan sus papas
42868,011,Problems,le pregunte quien le gusta y me clavo el visto,le pregunte quien le gusta, y me clavo el visto
42964,003,Ay Si,Hay si karol si,Hay si, karol si
42981,003,Ay Si,ay si te crees vergon veni a el salvador y te creo,ay si, te crees vergon veni a el salvador y te creo
42984,003,Ay Si,huy si te crees vergon veni a soya y te creo,huy si, te crees vergon veni a soya y te creo
42999,007,Futurama Fry,Soy yo o en america latina benfica no es importante,Soy yo, o en america latina benfica no es importante
43005,003,Ay Si,ay si las longas ADEFESIOS,ay si, las longas ADEFESIOS
43049,011,Problems,cuando hay la premiere de batman vs superman y el UMF tambien,cuando hay la premiere de batman vs superman, y el UMF tambien
43088,007,Futurama Fry,no se si los 2 estan drogados o son asi de boludos,no se si los 2 estan drogados, o son asi de boludos
43090,007,Futurama Fry,no se si estan drogados o son asi de boludos,no se si estan drogados, o son asi de boludos
43125,003,Ay Si,"ay si, ay si feliz dia del hombre nadie nos regala nada ni una jaba de bielas xd",ay si ay si, feliz dia del hombre nadie nos regala nada ni una jaba de bielas xd
43128,003,Ay Si,Hay si yo soy la que la obliga A subirce a la moto,Hay si, yo soy la que la obliga A subirce a la moto
43148,011,Problems,me dijo que tenia pocos graficos y me pide una g,me dijo que tenia pocos graficos, y me pide una g
43185,004,Bad Luck Brian,pone fotos porno lo banean por weon,pone fotos porno, lo banean por weon
43189,003,Ay Si,ay si segun superlider,ay si, segun superlider
43222,004,Bad Luck Brian,Anda de mamon No le dan pastel,Anda de mamon No, le dan pastel
43227,007,Futurama Fry,No estoy seguro si afirma.. o esta siendo sarcastico,No estoy seguro si afirma.., o esta siendo sarcastico
43290,006,Filosoraptor,si quiero vender ¿porque no en tu negocio santa marta ?,si quiero vender ,¿porque no en tu negocio santa marta ?
43292,012,Willy Wonka,asi que tu votas por guzman dime que se siente ser pulpin,asi que tu votas por guzman ,dime que se siente ser pulpin
43296,010,Prepare Yourself,Chicos preparense la maestra dara las calificaciones,Chicos preparense, la maestra dara las calificaciones
43299,004,Bad Luck Brian,"Su primer gol en handball No se da cuenta, y es autogol",Su primer gol en handball No, se da cuenta y es autogol
43320,007,Futurama Fry,Es el... o ellas que no son dignas no se piensalo,Es el..., o ellas que no son dignas no se piensalo
43355,008,Matias Prats,ultima hora es pocos minutos cumple años el amor de mi vida Giovanni Garay,ultima hora, es pocos minutos cumple años el amor de mi vida Giovanni Garay
43412,007,Futurama Fry,nose si me kieres o solo soy un pasatiempo,nose si me kieres, o solo soy un pasatiempo
43478,012,Willy Wonka,dime que se siente no ser mrk,,dime que se siente no ser mrk
43479,012,Willy Wonka,asi que tienes el uniforme del seattle en la ps4 dime que se siente creerte el mega troll,asi que tienes el uniforme del seattle en la ps4 ,dime que se siente creerte el mega troll
43491,003,Ay Si,"ay si ,ay si ahora q estoy ocupado es q m van a escribir",ay si ay si, ahora q estoy ocupado es q m van a escribir
43537,003,Ay Si,Ay si ay si Te marco solo cargo mi cel,Ay si ay si, Te marco solo cargo mi cel
43566,003,Ay Si,ay si ay si publico pendejadas asquerosas pero no aguanto que me contesten,ay si ay si, publico pendejadas asquerosas pero no aguanto que me contesten
43606,012,Willy Wonka,¿Asi que tu eres judio viviendo como gentil? dime que se siente obligar a los gentiles a judaizarse,¿Asi que tu eres judio viviendo como gentil? ,dime que se siente obligar a los gentiles a judaizarse
43644,004,Bad Luck Brian,"pide que le hablen le habla, lo deja en visto",pide que le hablen le habla, lo deja en visto
43663,008,Matias Prats,ultimas noticias a nadie le importa lo que hagas,ultimas noticias, a nadie le importa lo que hagas
43682,012,Willy Wonka,asi que tienes 30 visitas en tu blog cuentame que se siente que ninguna sea de tu asesor,asi que tienes 30 visitas en tu blog ,cuentame que se siente que ninguna sea de tu asesor
43734,007,Futurama Fry,no se si oigo tambores o tormenta,no se si oigo tambores, o tormenta
43832,007,Futurama Fry,ale no me contesta o talves simplemente no le agrado,ale no me contesta, o talves simplemente no le agrado
43851,008,Matias Prats,Noticia de ultima hora Vas a morir,Noticia de ultima hora, Vas a morir
43856,011,Problems,No se que voy hacer ellos son puro tomar Paco Omar kike jorge amado   Victor peria y Kiko,No se que voy hacer ellos son puro tomar Paco Omar kike jorge amado   Victor peria, y Kiko
43857,011,Problems,No se que voy hacer ellos son puro tomar Paco Omar kike jorge amado  Jordan  Victor peria y Kiko,No se que voy hacer ellos son puro tomar Paco Omar kike jorge amado  Jordan  Victor peria, y Kiko
43858,003,Ay Si,perdona pero hoy es mi dia ay si trabajar domingo perdona sae,perdona pero hoy es mi dia ay si, trabajar domingo perdona sae
43860,003,Ay Si,ay si trabajar mi dia libre perdona sae,ay si, trabajar mi dia libre perdona sae
43896,003,Ay Si,ay si que miedo,ay si, que miedo
43941,012,Willy Wonka,asi que eres petrolero... dime que se siente ir al trabajo y no hacer nada,asi que eres petrolero... ,dime que se siente ir al trabajo y no hacer nada
44027,007,Futurama Fry,no se si bkcc esta loco o es weon,no se si bkcc esta loco, o es weon
44032,012,Willy Wonka,haci que te llamas marjhory dime que se siente volver gay a tus amigos,haci que te llamas marjhory ,dime que se siente volver gay a tus amigos
44074,004,Bad Luck Brian,pide ayuda para desafio No le dan ni una mota,pide ayuda para desafio No, le dan ni una mota
44116,008,Matias Prats,ultimas noticias! se a visto a la llorona en  longueuil!!!!!,ultimas noticias,! se a visto a la llorona en  longueuil!!!!!
44169,003,Ay Si,Ay si ay si Me dicen la gasolina,Ay si ay si, Me dicen la gasolina
44170,006,Filosoraptor,"Si la tierna historia del libro de Chris gardner inspiro la pelicula ""en busca de la felicidad"" ¿La historia psicotica de ""El cisne negro"" esta basada en el libro del mismo nombre?","Si la tierna historia del libro de Chris gardner inspiro la pelicula ""en busca de la felicidad"" ","¿La historia psicotica de ""El cisne negro"" esta basada en el libro del mismo nombre?"
44180,011,Problems,soy versatil me dijo y solo pickea keeper,soy versatil me dijo, y solo pickea keeper
44223,004,Bad Luck Brian,"Es ateo experto  que sabe que Dios existe, no cree porque no le conviene Su avion esta cayendo y clama a Jesus por salvacion",Es ateo experto  que sabe que Dios existe no cree porque no, le conviene Su avion esta cayendo y clama a Jesus por salvacion
44240,010,Prepare Yourself,preparense ceiich is coming,preparense, ceiich is coming
44248,012,Willy Wonka,Asi que tu eres pauleto Y dime que se siente ser gorriau y gobernau?,Asi que tu eres pauleto Y ,dime que se siente ser gorriau y gobernau?
44258,004,Bad Luck Brian,"Es ateo y dice que si hay vida despues de la muerte ya vera como se las arreglara Muere y va al infierno, clama misericordia  y Dios le contesta misericordia hay mientras estas vivo en la tierra, ahora no.",Es ateo y dice que si hay vida despues de la muerte ya vera como se las arreglara Muere y va al infierno clama misericordia  y Dios, le contesta misericordia hay mientras estas vivo en la tierra ahora no.
44318,003,Ay Si,"Huuuuy si aqui en la playa,con unas cervezas y unas amigas muy Cool !!!",Huuuuy si, aqui en la playacon unas cervezas y unas amigas muy Cool !!!
44320,004,Bad Luck Brian,Va a ver a Bad Religion El Lolla pone el escenario a lo ultimo,Va a ver a Bad Religion El Lolla pone el escenario a, lo ultimo
44338,011,Problems,riki solo la puntita y me taladro el intestino,riki solo la puntita, y me taladro el intestino
44351,003,Ay Si,Ay si ay si Mucho amor,Ay si ay si, Mucho amor
44385,004,Bad Luck Brian,hace doble whip nadie lo ve,hace doble whip nadie, lo ve
44507,004,Bad Luck Brian,Es recontra fiel Y se muere virgen,Es recontra fiel Y, se muere virgen
44514,004,Bad Luck Brian,Publica que apoye lo nacional hace un evento con el grupo mas importante del rap de chile,Publica que apoye, lo nacional hace un evento con el grupo mas importante del rap de chile
44522,004,Bad Luck Brian,publica que apoye lo nacional hace un evento con el grupo mas importante del rap de peru,publica que apoye, lo nacional hace un evento con el grupo mas importante del rap de peru
44527,004,Bad Luck Brian,mejor chupamela para que se duerma,mejor chupamela para que, se duerma
44537,012,Willy Wonka,"haber dime que se siente que te roben, Los mapas que Robaste",haber ,dime que se siente que te roben Los mapas que Robaste
44591,007,Futurama Fry,lo que esta enrollando no se si es un pito o un tabaco,lo que esta enrollando no se si es un pito, o un tabaco
44594,004,Bad Luck Brian,cuando vez a tu peor enemigo y se cae,cuando vez a tu peor enemigo y, se cae
44603,012,Willy Wonka,dime que se siente que mañana sea lunes Y tu no has hecho ninguna tarea,,dime que se siente que mañana sea lunes Y tu no has hecho ninguna tarea
44609,003,Ay Si,"hay si,se creen los mejores y  no saben nada del ciclo de kreps",hay si,se creen los mejores y  no saben nada del ciclo de kreps
44693,003,Ay Si,Ay si ay si no tomo mañana voy a montar bicicleta,Ay si ay si, no tomo mañana voy a montar bicicleta
44716,004,Bad Luck Brian,He ganado al zero lo pillas?,He ganado al zero, lo pillas?
44791,004,Bad Luck Brian,juega undertale lo mata el checkpoint,juega undertale, lo mata el checkpoint
44895,003,Ay Si,hay si como no no pongo foto x q estoy fea,hay si, como no no pongo foto x q estoy fea
44942,004,Bad Luck Brian,Viaja a gesell para ver a sus hermanos se fueron a mardel,Viaja a gesell para ver a sus hermanos, se fueron a mardel
44966,007,Futurama Fry,No Se Si Mis Amigos Son Borrachos o Yo soy muy sano,No Se Si Mis Amigos Son Borrachos, o Yo soy muy sano
44998,003,Ay Si,"ay si, ay si, mejor no digo nada",ay si ay si, mejor no digo nada
45011,004,Bad Luck Brian,se cree mucho porque se enfrenta al morelia apenas empata con un autogol,se cree mucho porque, se enfrenta al morelia apenas empata con un autogol
45014,013,Yao Wonka,asi que le vas al guadalajara asi que dime que se siente tener todo un estadio para ti solito,asi que le vas al guadalajara asi que ,dime que se siente tener todo un estadio para ti solito
45035,003,Ay Si,ay si Mr gandhi,ay si, Mr gandhi
45038,004,Bad Luck Brian,Tacon bajito Y que le rinda,Tacon bajito Y que, le rinda
45057,004,Bad Luck Brian,quiere mandar gg le rompen base,quiere mandar gg, le rompen base
45066,012,Willy Wonka,a si que eres de neblinas dime ¿ que se siente ser chingon?,a si que eres de neblinas ,dime ¿ que se siente ser chingon?
45110,004,Bad Luck Brian,Joker crea un grupo de WhatsApp Todos lo trollean,Joker crea un grupo de WhatsApp Todos, lo trollean
45151,012,Willy Wonka,¿horrible? ¡cuentame mas!,¿horrible? ¡,cuentame mas!
45171,003,Ay Si,ay si ay si me creo una Nebula gaseosa,ay si ay si, me creo una Nebula gaseosa
45193,007,Futurama Fry,No se si estoy viendo Junior MasterChef o Las Condes MasterChef,No se si estoy viendo Junior MasterChef, o Las Condes MasterChef
45198,003,Ay Si,"ay si, ay si, muy eropeo el hp y parece cara de murcielagos",ay si ay si, muy eropeo el hp y parece cara de murcielagos
45200,003,Ay Si,"ay si, ay si, muy eropeo el hp y parece cara de murcielago",ay si ay si, muy eropeo el hp y parece cara de murcielago
45201,003,Ay Si,ay si ay si siembro rodillas en toda la cuadra,ay si ay si, siembro rodillas en toda la cuadra
45241,013,Yao Wonka,"Asi que te burlas de los policias por ""la comunidad del anillo""??? dime que se siente que te esten clavando desde la habana???","Asi que te burlas de los policias por ""la comunidad del anillo""??? ",dime que se siente que te esten clavando desde la habana???
45247,007,Futurama Fry,no se si estoy medio ivan o medio yahir,no se si estoy medio ivan, o medio yahir
45312,004,Bad Luck Brian,le hacen una menea lo cagan con una luca,le hacen una menea, lo cagan con una luca
45315,003,Ay Si,ay si ay si gracias por las.fotos queremos recuerditos queee,ay si ay si, gracias por las.fotos queremos recuerditos queee
45326,007,Futurama Fry,no se si es una clase de bioquimica o de nutricion,no se si es una clase de bioquimica, o de nutricion
45375,006,Filosoraptor,me pregunto... ¿por que este man sera tan pendejo?,me pregunto... ,¿por que este man sera tan pendejo?
45389,003,Ay Si,Ay si ay si Yo ago memes del hector,Ay si ay si, Yo ago memes del hector
45404,003,Ay Si,Ay si ay si Yo le tomo una foto a mi cabello,Ay si ay si, Yo le tomo una foto a mi cabello
45422,003,Ay Si,ay si ay si la perra culia se nos enojo,ay si ay si, la perra culia se nos enojo
45496,008,Matias Prats,Noticia. De ultima hora Juanita me enseño a hacer memes,Noticia. De ultima hora, Juanita me enseño a hacer memes
45545,012,Willy Wonka,asi que robandote mis imagenes dime que se siente ser tan poco original,asi que robandote mis imagenes ,dime que se siente ser tan poco original
45588,004,Bad Luck Brian,va asu primer concierto de rock y piensa que se va a presentar rio roma,va asu primer concierto de rock y piensa que, se va a presentar rio roma
45649,008,Matias Prats,en ultimas noticias ocar no vino x q no tenia pana para el atol,en ultimas noticias, ocar no vino x q no tenia pana para el atol
45663,006,Filosoraptor,si sacaran a todos los candidatos por regalar cosas ¿por quien votariamos?,si sacaran a todos los candidatos por regalar cosas ,¿por quien votariamos?
45727,004,Bad Luck Brian,rifa una tarjeta de facebook lo acosan de hacker,rifa una tarjeta de facebook, lo acosan de hacker
45730,003,Ay Si,hay sii ii!! te pago el martes,hay si,i ii!! te pago el martes
45750,004,Bad Luck Brian,dice que a nadie le importa ver jugar a los pumas Lo dice despues de ver todo el partido,dice que a nadie, le importa ver jugar a los pumas Lo dice despues de ver todo el partido
45802,004,Bad Luck Brian,"hizo un regalo por el dia del padre le dijo que el no era su padre, que se lo diese al vecino",hizo un regalo por el dia del padre le dijo que el no era su padre que, se lo diese al vecino
45883,003,Ay Si,ay si ay si me contrataton en televisa,ay si ay si, me contrataton en televisa
45923,003,Ay Si,ay si estoy comprometido otra cosa q ya no te gustan las mujeres,ay si, estoy comprometido otra cosa q ya no te gustan las mujeres
45924,007,Futurama Fry,El cumple era piola o nunca pidieron la sede,El cumple era piola, o nunca pidieron la sede
45925,007,Futurama Fry,Charlete NUNCA PIDIO LA SEDE o el cumple era piola,Charlete NUNCA PIDIO LA SEDE, o el cumple era piola
45950,003,Ay Si,ay si que no vas a ver nada,ay si, que no vas a ver nada
45968,003,Ay Si,ay si ay si yo si estuve en el cumple de sil y andre,ay si ay si, yo si estuve en el cumple de sil y andre
45973,003,Ay Si,ay si ay si estoy en el cumple de sil y andre,ay si ay si, estoy en el cumple de sil y andre
46026,004,Bad Luck Brian,juega minecraft le gana RAZORGAMER,juega minecraft, le gana RAZORGAMER
46029,004,Bad Luck Brian,le regalan una maquina de escribir le entra un virus,le regalan una maquina de escribir, le entra un virus
46039,003,Ay Si,"Ay si, ay si. Hablando de ñencadas",Ay si ay si,. Hablando de ñencadas
46049,006,Filosoraptor,cuando hablan de monitoreo ¿se referira a un mono toreando?,cuando hablan de monitoreo ,¿se referira a un mono toreando?
46077,012,Willy Wonka,"Esther, cuentanos que se siente Cuando te come el lobo",Esther ,cuentanos que se siente Cuando te come el lobo
46117,012,Willy Wonka,Asi que te gustan las chinas dime que se siente apoyar a keiko,Asi que te gustan las chinas ,dime que se siente apoyar a keiko
46157,008,Matias Prats,Buenos dias! Noticia de ultima hora Se le avisa a caperucita de que su lobito ya va en camino....,Buenos dias! Noticia de ultima hora, Se le avisa a caperucita de que su lobito ya va en camino....
46162,003,Ay Si,Se bas al cine con el amor De su vida son k jas ay si.?,Se bas al cine con el amor De su vida son k jas ay si,.?
46205,004,Bad Luck Brian,Nunca sale de fiesta Sale y se despanocha,Nunca sale de fiesta Sale y, se despanocha
46208,003,Ay Si,Ay si ay si Tengo todo en mi iCloud,Ay si ay si, Tengo todo en mi iCloud
46249,004,Bad Luck Brian,y el gordo cree que se la esta comiendo,y el gordo cree que, se la esta comiendo
46253,011,Problems,me dijo que no hariamos nada y me la metio en seco,me dijo que no hariamos nada, y me la metio en seco
46284,004,Bad Luck Brian,cumple años no se lo celebra el q2,cumple años no, se lo celebra el q2
46296,003,Ay Si,ay si cmo no ay k trabajar,ay si, cmo no ay k trabajar
46307,003,Ay Si,"Ay si, ay si Ya dijo que sabe hacer memes",Ay si ay si, Ya dijo que sabe hacer memes
46309,012,Willy Wonka,dime que se siente ser de paraguay que todos te discriminen xr ser un pais lleno de albañiles y artesanos,,dime que se siente ser de paraguay que todos te discriminen xr ser un pais lleno de albañiles y artesanos
46348,011,Problems,Cada vez que me mencionan a Yomil y El Dany I born to be American... Dejenme en paz,Cada vez que me mencionan a Yomil, y El Dany I born to be American... Dejenme en paz
46400,003,Ay Si,ay si que monton,ay si, que monton
46401,012,Willy Wonka,asi que fuiste este año a el festival de cerro de san pedro dime que se siente no haber ido cuando se ponian buenos,asi que fuiste este año a el festival de cerro de san pedro ,dime que se siente no haber ido cuando se ponian buenos
46460,007,Futurama Fry,no se si esta de frente o esta de espalda,no se si esta de frente, o esta de espalda
46472,012,Willy Wonka,Asi que eres adivina? dime donde vivire cuando sea grande!,Asi que eres adivina? ,dime donde vivire cuando sea grande!
46494,007,Futurama Fry,no se si quiere hablarme o pedirme un favor,no se si quiere hablarme, o pedirme un favor
46532,003,Ay Si,uy si k te digo amiga,uy si, k te digo amiga
46581,011,Problems,teo me pidio que lo sacara y le dije que no...,teo me pidio que lo sacara, y le dije que no...
46625,006,Filosoraptor,¿la mejor familia? ummmmmm,,¿la mejor familia? ummmmmm
46637,004,Bad Luck Brian,Se presenta a Masterchef Colombia Se le ahuma hasta el agua,Se presenta a Masterchef Colombia Se, le ahuma hasta el agua
46665,004,Bad Luck Brian,Hacen la ola en el estadio se ahoga,Hacen la ola en el estadio, se ahoga
46729,012,Willy Wonka,y dime que se siente trabajar en semana santa,y ,dime que se siente trabajar en semana santa
46736,011,Problems,"Me dijo que seria divertido y cuando llegue, ni siquiera habia manquehuito",Me dijo que seria divertido, y cuando llegue ni siquiera habia manquehuito
46754,012,Willy Wonka,interesante cuentame mas,interesante ,cuentame mas
46870,004,Bad Luck Brian,hace campañas por el buen trato le hacen bullynG a el,hace campañas por el buen trato, le hacen bullynG a el
46974,007,Futurama Fry,nose si me va a pagar o ... se esta haciendo la weona,nose si me va a pagar, o ... se esta haciendo la weona
47032,011,Problems,Todos se van para Since y yo me quedo via bua,Todos se van para Since, y yo me quedo via bua
47037,011,Problems,Todos se van para Since y yo me quedo,Todos se van para Since, y yo me quedo
47210,003,Ay Si,hay si como si me importara,hay si, como si me importara
47214,007,Futurama Fry,es idea mia o todos estan poniendo indirectas en facebook,es idea mia, o todos estan poniendo indirectas en facebook
47218,003,Ay Si,"Ay si ay si, bien q se apuntan",Ay si ay si, bien q se apuntan
47231,003,Ay Si,ay si el sabeloro,ay si, el sabeloro
47248,007,Futurama Fry,Sos boludo o Has comido aca,Sos boludo, o Has comido aca
47301,003,Ay Si,"Ay si, ay si Nadamas saben que soy de veracruz y ya quieren fecha para la boda!!",Ay si ay si, Nadamas saben que soy de veracruz y ya quieren fecha para la boda!!
47330,003,Ay Si,Hay hay si me dan ticket Y le hecho la culpa a Antonio,Hay hay si, me dan ticket Y le hecho la culpa a Antonio
47333,004,Bad Luck Brian,Por fin entra a la industria le toca trabajar en vacaciones,Por fin entra a la industria, le toca trabajar en vacaciones
47442,003,Ay Si,ay si Leollen va tu solo,ay si, Leollen va tu solo
47481,011,Problems,me dijo que no podia hablar y fue a Con,me dijo que no podia hablar, y fue a Con
47492,003,Ay Si,uy si me debe una explicacion,uy si, me debe una explicacion
47585,006,Filosoraptor,¿de que color se pone un camaleon en un cuarto lleno de espejos?,,¿de que color se pone un camaleon en un cuarto lleno de espejos?
47605,006,Filosoraptor,¿Si le doy un perro caliente a un perro y se lo come Se convierte en un perro canibal?,,¿Si le doy un perro caliente a un perro y se lo come Se convierte en un perro canibal?
47645,011,Problems,toy triste y  todo por tu culpa,toy triste, y  todo por tu culpa
47662,011,Problems,Quise denunciar un acoso y todo villas se burlo de mi,Quise denunciar un acoso, y todo villas se burlo de mi
47671,006,Filosoraptor,¿de que color son los espejos?,,¿de que color son los espejos?
47714,012,Willy Wonka,Asi que quieres ir al faro dime que se siente quedar negativo,Asi que quieres ir al faro ,dime que se siente quedar negativo
47823,011,Problems,me dijo que solo un par de cervezas para animarse a cantar Ya lleva 6 baldes y dice que todavia no esta preparado,me dijo que solo un par de cervezas para animarse a cantar Ya lleva 6 baldes, y dice que todavia no esta preparado
47884,004,Bad Luck Brian,intenta seducir no le sale,intenta seducir no, le sale
47970,004,Bad Luck Brian,juega pokemon le sale un digimon,juega pokemon, le sale un digimon
47980,004,Bad Luck Brian,Les dice a sus papas que se escapara de casa Viven en la calle,Les dice a sus papas que, se escapara de casa Viven en la calle
47981,004,Bad Luck Brian,Le dice a sus papas que se escapara de casa Viven en la calle,Le dice a sus papas que, se escapara de casa Viven en la calle
47991,004,Bad Luck Brian,brayan juega con flor y le gane !! y pierde con el tio Por goleada!!! jajajaajaj,brayan juega con flor y, le gane !! y pierde con el tio Por goleada!!! jajajaajaj
48000,004,Bad Luck Brian,es una gordis montañera de San pacho y le caen mal los frijoles!!! ajajajja,es una gordis montañera de San pacho y, le caen mal los frijoles!!! ajajajja
48011,012,Willy Wonka,"Asi que sabes escalas,acordes y tecnicas pero dime... que se siente saber eso y no acompañar bien???",Asi que sabes escalasacordes y tecnicas pero ,dime... que se siente saber eso y no acompañar bien???
48014,012,Willy Wonka,dime que se siente ser nieto de el indio,,dime que se siente ser nieto de el indio
48045,007,Futurama Fry,soy yo o se quemo los pies?,soy yo, o se quemo los pies?
48136,006,Filosoraptor,si car es coche y men es hombre ¿ es que mi tia carmen es un transformer ?,si car es coche y men es hombre ,¿ es que mi tia carmen es un transformer ?
48178,004,Bad Luck Brian,Hace los deberes por un dia el profesor no se los mira,Hace los deberes por un dia el profesor no, se los mira
48222,012,Willy Wonka,Asi que eres estudiante universitario dime que se siente no tener tiempo libre?,Asi que eres estudiante universitario ,dime que se siente no tener tiempo libre?
48255,011,Problems,dije que queria salchichon y me dio uno muy grande,dije que queria salchichon, y me dio uno muy grande
