,meme_id,plantilla,texto_no_tilde,text_1,text_2
161884,003,Ay Si,ay si esto es solo para brindis  grupo brindis jajaja,ay si, esto es solo para brindis  grupo brindis jajaja
161963,003,Ay Si,ay si ay si Yasmin no es coneja,ay si ay si, Yasmin no es coneja
162027,003,Ay Si,ay si ay si posteo que soy bien revolucionario y socialista como mi comandante desde mi ifon y mi makbuk mientras tomo cafe de estarbuks,ay si ay si, posteo que soy bien revolucionario y socialista como mi comandante desde mi ifon y mi makbuk mientras tomo cafe de estarbuks
162038,004,Bad Luck Brian,Intenta desintoxicarse de heroina con metadona y se hace adicto a esa cetona,Intenta desintoxicarse de heroina con metadona y, se hace adicto a esa cetona
162044,004,Bad Luck Brian,piden.ascenso y lo despiden,piden.ascenso y, lo despiden
162046,004,Bad Luck Brian,No lo digas Solo haslo y yo mirare,No, lo digas Solo haslo y yo mirare
162055,004,Bad Luck Brian,Va vestida para mostrar que es gay se come a un hombre en vez de una mina,Va vestida para mostrar que es gay, se come a un hombre en vez de una mina
162077,004,Bad Luck Brian,Dijiste que jamas lo amaste Y por cosas asi no te creo nada,Dijiste que jamas, lo amaste Y por cosas asi no te creo nada
162109,006,Filosoraptor,si dormir es gratis ¿por que cuesta tanto levantarse?,si dormir es gratis ,¿por que cuesta tanto levantarse?
162111,006,Filosoraptor,Si los mosquitos transmiten el Zika ¿Por que sus bebes no tienen la cabeza chiquita?,Si los mosquitos transmiten el Zika ,¿Por que sus bebes no tienen la cabeza chiquita?
162171,006,Filosoraptor,Si ayer fue black friday... ¿hoy es black sabbath?,Si ayer fue black friday... ,¿hoy es black sabbath?
162190,003,Ay Si,Ay si ay si Soy comunicador,Ay si ay si, Soy comunicador
162254,003,Ay Si,Hay si ya voy a Frida Y no hablo,Hay si, ya voy a Frida Y no hablo
162259,004,Bad Luck Brian,Dime que se siente embarazarte En pleno siglo XXI,Dime que, se siente embarazarte En pleno siglo XXI
162288,007,Futurama Fry,"Pienso,observo... ¿pongo o coloco?",Piensoobservo... ¿pongo, o coloco?
162307,003,Ay Si,Huy si Les voy a demostrar para que son las cherokees,Huy si, Les voy a demostrar para que son las cherokees
162308,004,Bad Luck Brian,Su primer partido de titular se lesiona a los 10 min,Su primer partido de titular, se lesiona a los 10 min
162335,004,Bad Luck Brian,Toca gratis Leon Bruno Si Su esposa no lo quiere dejar ir,Toca gratis Leon Bruno Si Su esposa no, lo quiere dejar ir
162337,008,Matias Prats,"Noticia de ultima hora!!!! Estan cayendo bombas en Valpraiso, no se acerque!!!!!",Noticia de ultima hora,!!!! Estan cayendo bombas en Valpraiso no se acerque!!!!!
162341,008,Matias Prats,Noticia de ultima hora!!!! Estan cayendo misiles en VALPO y Florida!!! Zona minada!!!!,Noticia de ultima hora,!!!! Estan cayendo misiles en VALPO y Florida!!! Zona minada!!!!
162348,012,Willy Wonka,asi k naces en noviembre dime k se siente ser el producto del 14  febrero,asi k naces en noviembre ,dime k se siente ser el producto del 14  febrero
162355,004,Bad Luck Brian,sale a rayar por 1ra vez lo pillan lol,sale a rayar por 1ra vez, lo pillan lol
162368,003,Ay Si,hay si ya me awuite,hay si, ya me awuite
162369,005,Disaster Girl,Pidele un credito a la chabelita decian No pasara nada me decian,Pidele un credito a la chabelita decian No pasara nada me ,decian
162409,013,Yao Wonka,Hice una farsa de que me apuñalaban dime que se siente que te mienta de nuevo en otro video ...,Hice una farsa de que me apuñalaban ,dime que se siente que te mienta de nuevo en otro video ...
162446,004,Bad Luck Brian,Pide un acenso y lo despiden,Pide un acenso y, lo despiden
162452,004,Bad Luck Brian,Se juega el partido de su vida Nacional le pone el tercer  equipo,Se juega el partido de su vida Nacional, le pone el tercer  equipo
162510,004,Bad Luck Brian,Hay fiesta en Escalona Y le toca pagar servicio Militar,Hay fiesta en Escalona Y, le toca pagar servicio Militar
162559,006,Filosoraptor,"Si alejandro es mrlegba Entonces, ¿mrlegba es alejandro?",Si alejandro es mrlegba Entonces ,¿mrlegba es alejandro?
162562,006,Filosoraptor,"Si Quien Tatua debe TENER TATUAJES, ¿QUIEN HACE PAN DEBE TENER BRAZOS DE REINA?",Si Quien Tatua debe TENER TATUAJES ,¿QUIEN HACE PAN DEBE TENER BRAZOS DE REINA?
162575,006,Filosoraptor,si Adan y eva fueron los primeros... ¿por que tienen ombligo?,si Adan y eva fueron los primeros... ,¿por que tienen ombligo?
162663,006,Filosoraptor,¿como se dice suegra en chino? lin,,¿como se dice suegra en chino? lin
162708,007,Futurama Fry,¿No se si soy yo o a Andrea le gusta alguien?,¿No se si soy yo, o a Andrea le gusta alguien?
162725,008,Matias Prats,ultima hora no saldra manuelxitho a la farra,ultima hora, no saldra manuelxitho a la farra
162752,007,Futurama Fry,Alla se ve venir el viernes o sea que es jueves,Alla se ve venir el viernes, o sea que es jueves
162753,007,Futurama Fry,no me acuerdo si cada entregable se entrega por separado o todos juntos,no me acuerdo si cada entregable se entrega por separado, o todos juntos
162766,004,Bad Luck Brian,Pide ayuda Todos se rien,Pide ayuda Todos, se rien
162777,003,Ay Si,Ay si ay si...me dicen el camaron crudo! Ayyyy....me duele mi rodillita Moi.,Ay si ay si,...me dicen el camaron crudo! Ayyyy....me duele mi rodillita Moi.
162836,008,Matias Prats,ultimas noticias Toro no aparece,ultimas noticias, Toro no aparece
162893,003,Ay Si,"Ay si ay si me burlo que Aurelio Nuño dice ""ler"" Y al final tienen nula comprension de lectura",Ay si ay si," me burlo que Aurelio Nuño dice ""ler"" Y al final tienen nula comprension de lectura"
162983,003,Ay Si,ay si que miedoo mira como tiemblo,ay si, que miedoo mira como tiemblo
163002,003,Ay Si,ay si daniela,ay si, daniela
163043,004,Bad Luck Brian,she querido!!!! se le moja el pc,she querido!!!!, se le moja el pc
163064,008,Matias Prats,Noticia de ultima hora: a sherelyn le duele la jipa,Noticia de ultima hora,: a sherelyn le duele la jipa
163113,008,Matias Prats,ultimas noticias no me importa,ultimas noticias, no me importa
163142,011,Problems,Cuando escuchas una cancion que te gusta y no sabes su nombre,Cuando escuchas una cancion que te gusta, y no sabes su nombre
163260,004,Bad Luck Brian,se para enfrente de nasus nasus lo termina farmeando xd,se para enfrente de nasus nasus, lo termina farmeando xd
163292,004,Bad Luck Brian,Se queda el sabado en casa Todos se van a la calle y lo dejan solo,Se queda el sabado en casa Todos se van a la calle y, lo dejan solo
163293,008,Matias Prats,Y en las ultimas noticias ya no existira el unmod!,Y en las ultimas noticias, ya no existira el unmod!
163317,003,Ay Si,"Ay si, ay si, de chiripa pero ganamos.",Ay si ay si, de chiripa pero ganamos.
163347,003,Ay Si,ay si ay si el comentario no es para mi pero soy bien metiche ay si,ay si ay si, el comentario no es para mi pero soy bien metiche ay si
163390,003,Ay Si,"Ay si, ay si yo siempre lo vendo en la agencia Aunque me paguen $10,000 menos que en 360autocompras",Ay si ay si, yo siempre lo vendo en la agencia Aunque me paguen $10000 menos que en 360autocompras
163401,003,Ay Si,uy uy si no me importa,uy uy si, no me importa
163455,012,Willy Wonka,asi que aprobaste tu primer examen ¿dime que se siente saber que haras otros 4 examenes en el futuro?,asi que aprobaste tu primer examen ¿,dime que se siente saber que haras otros 4 examenes en el futuro?
163456,004,Bad Luck Brian,va a su tienda favorita lo corren por que creen que tiene otra  tienda favorita,va a su tienda favorita, lo corren por que creen que tiene otra  tienda favorita
163470,007,Futurama Fry,no se si reiniciar el nivel por que voy a perder o dejar que me maten,no se si reiniciar el nivel por que voy a perder, o dejar que me maten
163476,006,Filosoraptor,me pregunto ¿por que la gente mete cosas redondas en cajas cuadradas,me pregunto ,¿por que la gente mete cosas redondas en cajas cuadradas
163481,004,Bad Luck Brian,se compra una casa se la quitan el mismo dia,se compra una casa, se la quitan el mismo dia
163532,006,Filosoraptor,Si descargo una pelicula en Jamaica ¿soy un pirata del caribe?,Si descargo una pelicula en Jamaica ,¿soy un pirata del caribe?
163592,012,Willy Wonka,"Y cuentanos, que se siente hacerle el deck al gordo Y que llegue a semifinales y tu 40",Y ,cuentanos que se siente hacerle el deck al gordo Y que llegue a semifinales y tu 40
163594,012,Willy Wonka,"Y cuentanos, que se siente hacerle el deck al gordo Y que llegue a semifinales y tu?",Y ,cuentanos que se siente hacerle el deck al gordo Y que llegue a semifinales y tu?
163687,011,Problems,cuando tengo hambre y leo como agua para chocolate,cuando tengo hambre, y leo como agua para chocolate
163750,004,Bad Luck Brian,matricula de honor en bioquimica pero la cara de chalao no se la quita nadie,matricula de honor en bioquimica pero la cara de chalao no, se la quita nadie
163775,004,Bad Luck Brian,se aburre de salir segundo en el futbol con argentina se hace hincha del tenis y segundos otra vez,se aburre de salir segundo en el futbol con argentina, se hace hincha del tenis y segundos otra vez
163868,008,Matias Prats,Noticia de ultima hora lis cumple años,Noticia de ultima hora, lis cumple años
163945,004,Bad Luck Brian,Es presidente para el centenario se muere un mes antes,Es presidente para el centenario, se muere un mes antes
163947,004,Bad Luck Brian,Loren estas beodo Y lo sabes,Loren estas beodo Y, lo sabes
163962,003,Ay Si,Hay si hoy es el cumpleaños De Tamara,Hay si, hoy es el cumpleaños De Tamara
163964,003,Ay Si,Ay si ay si Metase a la mandala,Ay si ay si, Metase a la mandala
164022,004,Bad Luck Brian,Bongonda marca su primer gol No lo pone...,Bongonda marca su primer gol No, lo pone...
164104,004,Bad Luck Brian,Intenta hacer un golpe de estado para poner a ibañez al poder se rinden y los acribillan,Intenta hacer un golpe de estado para poner a ibañez al poder, se rinden y los acribillan
164146,011,Problems,La zoili y la rome Deben de estar llorando hdp,La zoili, y la rome Deben de estar llorando hdp
164262,012,Willy Wonka,asi que eres de la alianza verdad haver dime que se siente ir con tu tazita de aliamza a recibir chocolatada en el quino,asi que eres de la alianza verdad haver ,dime que se siente ir con tu tazita de aliamza a recibir chocolatada en el quino
164300,003,Ay Si,Ay si ay si Es q soy madre,Ay si ay si, Es q soy madre
164349,011,Problems,enserio q bonita te quiero amorsito nunka me habia dado cuenta q tu querias muchas cosas conmigo y yo llorando por otra q no me valora cm tu lo haces  te amo mi amorsito,enserio q bonita te quiero amorsito nunka me habia dado cuenta q tu querias muchas cosas conmigo, y yo llorando por otra q no me valora cm tu lo haces  te amo mi amorsito
164366,004,Bad Luck Brian,"Pide que lo muerdan para hacerse vampiro lee la quest, va y se cura el vampirismo",Pide que, lo muerdan para hacerse vampiro lee la quest va y se cura el vampirismo
164401,003,Ay Si,"Ay si, ay si Pongo indirectas en mi perfil para que los mire",Ay si ay si, Pongo indirectas en mi perfil para que los mire
164402,006,Filosoraptor,Si se engorda por la noche ¿Se adelgaza por la mañana?,Si se engorda por la noche ,¿Se adelgaza por la mañana?
164431,003,Ay Si,"Ay si, en Facebook gracias Dios por tus bendiciones Pero en persona son una porqueria, ay si",Ay si en Facebook gracias Dios por tus bendiciones Pero en persona son una porqueria ay si,
164454,012,Willy Wonka,te hiciste un super ganker dime que se siente tratar de gankear un tank y morir en el intento,te hiciste un super ganker ,dime que se siente tratar de gankear un tank y morir en el intento
164459,007,Futurama Fry,no se si lo dice de coña o si lo dice de verdad,no se si lo dice de coña, o si lo dice de verdad
164508,003,Ay Si,como cuando maria se pone brava uy si que miedito,como cuando maria se pone brava uy si, que miedito
164574,008,Matias Prats,ultimas noticias tammy no sabe quien hizo el meme,ultimas noticias, tammy no sabe quien hizo el meme
164692,003,Ay Si,"uy si, uy si, te dices progresista pero eres homofobico",uy si uy si, te dices progresista pero eres homofobico
164719,006,Filosoraptor,¿Raro cuando La vida es tonta?,,¿Raro cuando La vida es tonta?
164740,011,Problems,me dijo que estudiara toda la materia de lenguaje y no entro ni una wea de eso,me dijo que estudiara toda la materia de lenguaje, y no entro ni una wea de eso
164743,003,Ay Si,Ay ai ay si Ahora todos estan activis en el grupo,Ay ai ay si, Ahora todos estan activis en el grupo
164744,004,Bad Luck Brian,Es su cumpleaños a facebook se le olvida,Es su cumpleaños a facebook, se le olvida
164849,004,Bad Luck Brian,"Llega su cumpleaños Le da diarrea, vomito, se intoxica y orina oscuro",Llega su cumpleaños Le da diarrea vomito, se intoxica y orina oscuro
164899,006,Filosoraptor,¿Es el autolike una especie de paja?,,¿Es el autolike una especie de paja?
164971,012,Willy Wonka,asi que eres inquisidor? cuentame que se siente que no completar un trial veterano,asi que eres inquisidor? ,cuentame que se siente que no completar un trial veterano
164983,012,Willy Wonka,Asi que eres inquisidor? cuentame que se siente no completar un trial veterano,Asi que eres inquisidor? ,cuentame que se siente no completar un trial veterano
164993,004,Bad Luck Brian,El America lo empina en cuartos Empiezan hablar de un partido de liga,El America, lo empina en cuartos Empiezan hablar de un partido de liga
165001,004,Bad Luck Brian,le gana 2 veces seguidas al america en su centenario america lo elimina en cuartos,le gana 2 veces seguidas al america en su centenario america, lo elimina en cuartos
165007,003,Ay Si,Ay si ay si ganes o pierdas Soy chiva de               corazon,Ay si ay si, ganes o pierdas Soy chiva de               corazon
165019,004,Bad Luck Brian,celebra eliminar al america de la mugrosa mx lo elimina otra vez el america de la liguilla,celebra eliminar al america de la mugrosa mx, lo elimina otra vez el america de la liguilla
165024,004,Bad Luck Brian,Va a la playa se le cae su celular,Va a la playa, se le cae su celular
165037,003,Ay Si,ay si ay si me la saco diciendo que los elimine de la mx,ay si ay si, me la saco diciendo que los elimine de la mx
165046,004,Bad Luck Brian,"El sorteo de la quiniela, lo premia con el superlider del futbol a xolos los elimina el equipo que entro de panzazo: el leon",El sorteo de la quiniela, lo premia con el superlider del futbol a xolos los elimina el equipo que entro de panzazo: el leon
165053,003,Ay Si,"uy si, uy si el era el festejado",uy si uy si, el era el festejado
165098,004,Bad Luck Brian,le hacen endodoncia le sacan la muela al siguiente dia,le hacen endodoncia, le sacan la muela al siguiente dia
165133,003,Ay Si,Ay si ay si Gano el america,Ay si ay si, Gano el america
165135,007,Futurama Fry,piensan que soy un macho recio con estilo unico y genial o un retrasado con gustos gay y nerd,piensan que soy un macho recio con estilo unico y genial, o un retrasado con gustos gay y nerd
165154,003,Ay Si,"ay si, ay si... ahora apruebo todos mis cursos por amnistia y me creo ingeniero... XD !!!",ay si ay si,... ahora apruebo todos mis cursos por amnistia y me creo ingeniero... XD !!!
165181,003,Ay Si,Ay si ay si Yo con Margarita,Ay si ay si, Yo con Margarita
165266,011,Problems,Cuando ganzo y patas empiezan a hablar de carros,Cuando ganzo, y patas empiezan a hablar de carros
165312,007,Futurama Fry,no se si estoy en el baño de la upc o en un baño publico,no se si estoy en el baño de la upc, o en un baño publico
165346,007,Futurama Fry,no se si el america jugo bien o el guadalajara jugo mal,no se si el america jugo bien, o el guadalajara jugo mal
165386,012,Willy Wonka,ay si cuentame mas,ay si ,cuentame mas
165396,008,Matias Prats,En ultimas noticias las Águilas derribaron A las cabras,En ultimas noticias, las Águilas derribaron A las cabras
165398,012,Willy Wonka,Asi que eres de BarcelonaSC... dime que se siente ser una copia Pero una copia de las que dab verguenz,Asi que eres de BarcelonaSC... ,dime que se siente ser una copia Pero una copia de las que dab verguenz
165399,012,Willy Wonka,dime que se siente estar ocupando la mesa del comedor para hacer trabajos grupales cuando hay espacios nuevos y con cafe gratis,,dime que se siente estar ocupando la mesa del comedor para hacer trabajos grupales cuando hay espacios nuevos y con cafe gratis
165401,012,Willy Wonka,Asi que eres de BarcelonaSC... dime que se siente ser una copia Pero una copia de las que dan verguenza,Asi que eres de BarcelonaSC... ,dime que se siente ser una copia Pero una copia de las que dan verguenza
165459,004,Bad Luck Brian,quieren hacer trampa 3 Tecnico les gana haciendo lo mismo que ellos,quieren hacer trampa 3 Tecnico les gana haciendo, lo mismo que ellos
165462,004,Bad Luck Brian,Compra chivas tv se le cae el cocon en el modem,Compra chivas tv, se le cae el cocon en el modem
165471,012,Willy Wonka,asi que eres de 2°b dime que se siente perder por muchos likes,asi que eres de 2°b ,dime que se siente perder por muchos likes
165481,004,Bad Luck Brian,Eres el cronista nadie se deja tomar fotos,Eres el cronista nadie, se deja tomar fotos
165507,004,Bad Luck Brian,Hace un browni de chocolate Se le olvida el chocolate,Hace un browni de chocolate Se, le olvida el chocolate
165510,003,Ay Si,ay si soy el unico bobo,ay si, soy el unico bobo
165529,003,Ay Si,cuando la que saca 20  se empieza a lucir ay si,cuando la que saca 20  se empieza a lucir ay si,
165593,011,Problems,Como cuando cortan la espada con yukine dentro y se acaba el capitulo,Como cuando cortan la espada con yukine dentro, y se acaba el capitulo
165680,007,Futurama Fry,trabajar o ir al gordo,trabajar, o ir al gordo
165732,006,Filosoraptor,Si cometes un delito mientras opositas Judicatura ¿Crimen novia Curia?,Si cometes un delito mientras opositas Judicatura ,¿Crimen novia Curia?
165733,006,Filosoraptor,Si cometes un delito  mientras opositas Judicatura ¿Crimen novit Curia?,Si cometes un delito  mientras opositas Judicatura ,¿Crimen novit Curia?
165812,003,Ay Si,"ay si, ay si se cree muy macho mostrando el pipi",ay si ay si, se cree muy macho mostrando el pipi
165834,003,Ay Si,Ay si ay si Pase a semifinales,Ay si ay si, Pase a semifinales
165845,004,Bad Luck Brian,"Va a un aeropuerto Se incendia, hay protesta o se cae el avion",Va a un aeropuerto Se incendia hay protesta o, se cae el avion
165857,004,Bad Luck Brian,andavas mame y mame que pumas seria campeon raul martinez lo elimina tigres,andavas mame y mame que pumas seria campeon raul martinez, lo elimina tigres
165861,003,Ay Si,"Ay si, ahora si se ponen la Camiseta del America, ay si",Ay si ahora si se ponen la Camiseta del America ay si,
165862,012,Willy Wonka,olvidaste tu cargador iphone dime que se siente no trolear a tu novio por whatsapp,olvidaste tu cargador iphone ,dime que se siente no trolear a tu novio por whatsapp
165893,004,Bad Luck Brian,va el Oscar a la cancha el partido se suspende,va el Oscar a la cancha el partido, se suspende
165912,007,Futurama Fry,son pacos? o flaites vestidos de pacos ?,son pacos?, o flaites vestidos de pacos ?
165947,012,Willy Wonka,dime raul martinez ... que se siente ser el esclavo de luis vargas,,dime raul martinez ... que se siente ser el esclavo de luis vargas
165967,012,Willy Wonka,asi que los de vpa te dan un aula del centro interno dime que se siente ser vital,asi que los de vpa te dan un aula del centro interno ,dime que se siente ser vital
165981,007,Futurama Fry,no se si pagar el diplomado o ser ejecutivo de centro interno,no se si pagar el diplomado, o ser ejecutivo de centro interno
165988,007,Futurama Fry,no se si matonear balance para conseguir voto o hablar mal de vital y frutal,no se si matonear balance para conseguir voto, o hablar mal de vital y frutal
165992,011,Problems,no se si matonear balance para conseguir voto o hablar mal de vital y frutal,no se si matonear balance para conseguir voto o hablar mal de vital, y frutal
165993,012,Willy Wonka,Asi que eres alumno del campus dime que se siente tener una escuela tan bonita y no cuidarla,Asi que eres alumno del campus ,dime que se siente tener una escuela tan bonita y no cuidarla
166022,013,Yao Wonka,asi que tu eres carlos? dime que se siente que te rechase mariana,asi que tu eres carlos? ,dime que se siente que te rechase mariana
166103,006,Filosoraptor,SI LOS DE FRUTAL SON EL ANTIGUO VPA ¿COMO ES QUE EL EJECTUVO DE SOI ES VPA?,SI LOS DE FRUTAL SON EL ANTIGUO VPA ,¿COMO ES QUE EL EJECTUVO DE SOI ES VPA?
166105,006,Filosoraptor,SI LOS DE FRUTAL SON EL ANTIGUO VPA ¿PORQUE EL EJECTUVO DE SOI ES DE VPA?,SI LOS DE FRUTAL SON EL ANTIGUO VPA ,¿PORQUE EL EJECTUVO DE SOI ES DE VPA?
166110,006,Filosoraptor,SI LOS DE FRUTAL SON EL ANTIGUO VPA ¿PORQUE LOS DE VITAL ESCONDEN A LOS ANTIGUOS DE VPA?,SI LOS DE FRUTAL SON EL ANTIGUO VPA ,¿PORQUE LOS DE VITAL ESCONDEN A LOS ANTIGUOS DE VPA?
166144,007,Futurama Fry,?me baño o no me baño? mejor noi,?me baño, o no me baño? mejor noi
166145,007,Futurama Fry,?me baño o no me baño? mejor no,?me baño, o no me baño? mejor no
166168,010,Prepare Yourself,preparense se vienen los tamales,preparense, se vienen los tamales
166231,008,Matias Prats,Noticia de ultima hora Se descubren parlantes enterrados,Noticia de ultima hora, Se descubren parlantes enterrados
166233,004,Bad Luck Brian,Apuesta que nacional le va a ganar a millonarios Nacional pierde: lo incapacitan,Apuesta que nacional le va a ganar a millonarios Nacional pierde:, lo incapacitan
166252,004,Bad Luck Brian,porfin dejan al coro cantar se equivocan en todos los cantos,porfin dejan al coro cantar, se equivocan en todos los cantos
166255,003,Ay Si,hay sii mariano y pablo que malotess,hay si,i mariano y pablo que malotess
166320,004,Bad Luck Brian,Tiene prueba No le funcionan los pc,Tiene prueba No, le funcionan los pc
166330,003,Ay Si,Ay si ay si No quiero cocinar,Ay si ay si, No quiero cocinar
166396,012,Willy Wonka,asi que tu tia se llama norma'??? dime que se siente tener la mejor tia del mundo?,asi que tu tia se llama norma'??? ,dime que se siente tener la mejor tia del mundo?
166403,007,Futurama Fry,No Se SII ardilla es gay o muy gay,No Se SII ardilla es gay, o muy gay
166410,007,Futurama Fry,no se si es la lista A o memes uach,no se si es la lista A, o memes uach
166435,012,Willy Wonka,Bueno dime que se siente no poder celebrar una final Mena violador,Bueno ,dime que se siente no poder celebrar una final Mena violador
166463,012,Willy Wonka,"a si que subiste a grand champion? dime, que se siente que tu primo te boosteeh",a si que subiste a grand champion? ,dime que se siente que tu primo te boosteeh
166473,007,Futurama Fry,nose si es que juego mal o el juego se lagea mucho,nose si es que juego mal, o el juego se lagea mucho
166476,007,Futurama Fry,no se si es gay el señor burns o es ultra gay,no se si es gay el señor burns, o es ultra gay
166551,003,Ay Si,Ay si ay si Todo yanisbel,Ay si ay si, Todo yanisbel
166571,011,Problems,Me dijo: voy a por tabaco ... y ¡ volvio !,Me dijo: voy a por tabaco ..., y ¡ volvio !
166575,006,Filosoraptor,¿sera que ediel es capaz con esaa china de miranda? como le gustan son ancianas y con cara olible,,¿sera que ediel es capaz con esaa china de miranda? como le gustan son ancianas y con cara olible
166579,003,Ay Si,hay si to el munto engordo menos unos cuantos,hay si, to el munto engordo menos unos cuantos
166629,003,Ay Si,Ay si ay si tan creida Y se baña con jabon de coche,Ay si ay si, tan creida Y se baña con jabon de coche
166638,003,Ay Si,ay si ay si tan creido y no tiene camiseta mapache,ay si ay si, tan creido y no tiene camiseta mapache
166752,005,Disaster Girl,decian que mi hermana era cursi ...bueno decian...,decian que mi hermana era cursi ...bueno ,decian...
166762,011,Problems,me dijo que era empresario de ropa y es camillero,me dijo que era empresario de ropa, y es camillero
166785,006,Filosoraptor,si pierdo mi auto ¿ya no sere autoritario?,si pierdo mi auto ,¿ya no sere autoritario?
166798,006,Filosoraptor,hola grupo sale algo hoy o nada?¿,hola grupo sale algo hoy o nada?,¿
166804,003,Ay Si,uuuuuy si como no,uuuuuy si, como no
166842,006,Filosoraptor,Si estoy a favor de la adopcion gay y en cintra del aborto ¿soy conservador oprogresista?,Si estoy a favor de la adopcion gay y en cintra del aborto ,¿soy conservador oprogresista?
166849,006,Filosoraptor,Si estoy a favor de la adopcion gay y en cintra del aborto ¿soy conservador o progresista?,Si estoy a favor de la adopcion gay y en cintra del aborto ,¿soy conservador o progresista?
166853,004,Bad Luck Brian,Es navidad papa noel lo atropella con su carruaje,Es navidad papa noel, lo atropella con su carruaje
166916,007,Futurama Fry,No se si es mala suerte o es pobreza,No se si es mala suerte, o es pobreza
166933,004,Bad Luck Brian,va a cazar un vendedor de drogas falso lo apuñala con un cuchillo de plastico en la espalda ... se lastima el abdomen,va a cazar un vendedor de drogas falso, lo apuñala con un cuchillo de plastico en la espalda ... se lastima el abdomen
166947,004,Bad Luck Brian,Ya se cree campeon Le gano a pumas,Ya, se cree campeon Le gano a pumas
166951,004,Bad Luck Brian,No va a top guns por su funda para sigsauer p2022 porque piensa que se agotaron ya llegaron y con stock limitado!,No va a top guns por su funda para sigsauer p2022 porque piensa que, se agotaron ya llegaron y con stock limitado!
166988,006,Filosoraptor,SI el estado rige en algunas cosas ¿Los autoritarios seran felices?,SI el estado rige en algunas cosas ,¿Los autoritarios seran felices?
167001,012,Willy Wonka,aber dime mas,aber ,dime mas
167015,006,Filosoraptor,¿si me hago actor porno... ...podre decir que mi pene me da de comer?,,¿si me hago actor porno... ...podre decir que mi pene me da de comer?
