,meme_id,plantilla,texto_no_tilde,text_1,text_2
59106,012,Willy Wonka,asi que vas a la escuela en viernes dime que se siente Merary? ñ,asi que vas a la escuela en viernes ,dime que se siente Merary? ñ
59108,012,Willy Wonka,asi que vas a la escuela en viernes dime que se siente Merary,asi que vas a la escuela en viernes ,dime que se siente Merary
59179,003,Ay Si,Ay si ay si somos manitas Ora si contra el Alan,Ay si ay si, somos manitas Ora si contra el Alan
59319,011,Problems,Lloraras y lloraras sin nadie que te consuele,Lloraras, y lloraras sin nadie que te consuele
59364,007,Futurama Fry,Este wey Es o se hace,Este wey Es, o se hace
59365,007,Futurama Fry,Este primo p. Es o se hace,Este primo p. Es, o se hace
59398,010,Prepare Yourself,lan preparense miss fortune supp en ranked se aproxima,lan preparense, miss fortune supp en ranked se aproxima
59411,004,Bad Luck Brian,me roban el celular me compro otro a los dos dias me lo roba la policia,me roban el celular me compro otro a los dos dias me, lo roba la policia
59415,004,Bad Luck Brian,"me roban el celular, me compro otro a los dos dias me lo roba la policia",me roban el celular me compro otro a los dos dias me, lo roba la policia
59448,008,Matias Prats,noticia de ultima hora SE CASAN KATHA Y HERNY en el faro de cota,noticia de ultima hora, SE CASAN KATHA Y HERNY en el faro de cota
59476,003,Ay Si,ay si ay si soy asly y no me dan risa los memes del ruben,ay si ay si, soy asly y no me dan risa los memes del ruben
59480,007,Futurama Fry,no se si eres idiota o si te haces,no se si eres idiota, o si te haces
59486,004,Bad Luck Brian,"Las chicas de ahora escuchaban reggeaton Ahora se creen las rockeras y solamente escuchan:la berisso,cjs y ntvg",Las chicas de ahora escuchaban reggeaton Ahora, se creen las rockeras y solamente escuchan:la berissocjs y ntvg
59573,011,Problems,Recuerdo que mañana es sabado y te das cuenta que mañana publican los resultados del icfes,Recuerdo que mañana es sabado, y te das cuenta que mañana publican los resultados del icfes
59621,003,Ay Si,hay si que bien tocas,hay si, que bien tocas
59631,003,Ay Si,"Ay si, ay si nada mas por las invasiones barbaras todos querian estudiar en los monasterios",Ay si ay si, nada mas por las invasiones barbaras todos querian estudiar en los monasterios
59652,004,Bad Luck Brian,quiere que sus alumnos se desarrollen y estudien libremente retoma el modelo escolastico en sus clases,quiere que sus alumnos, se desarrollen y estudien libremente retoma el modelo escolastico en sus clases
59656,006,Filosoraptor,¿Con Que?,,¿Con Que?
59665,005,Disaster Girl,Invitarme a pistear decian No hare desmadre decian,Invitarme a pistear decian No hare desmadre ,decian
59677,005,Disaster Girl,"mi maestro decia ""la letra con sangre se aprende"" decia...","mi maestro decia ""la letra con sangre se aprende"" ",decia...
59682,005,Disaster Girl,decia la escolastica: dios siempre sera el centro de todo decia... el humanismo llego,decia la escolastica: dios siempre sera el centro de todo ,decia... el humanismo llego
59778,004,Bad Luck Brian,Marcha por sus derechos lo matan,Marcha por sus derechos, lo matan
59826,004,Bad Luck Brian,fuma marihuana para estudiar mejor se le olvida la fecha del examen,fuma marihuana para estudiar mejor, se le olvida la fecha del examen
59867,011,Problems,Por fin llego el viernes! y tambien el recibo de la luz :(,Por fin llego el viernes!, y tambien el recibo de la luz :(
59884,003,Ay Si,ay si  no me toque al niño,ay si,  no me toque al niño
59930,003,Ay Si,Hay si km ahora soy pastora ya no t pelo,Hay si, km ahora soy pastora ya no t pelo
59944,004,Bad Luck Brian,apenas el titulo de fnaf y le da un infarto  chicos)@ me entieden,apenas el titulo de fnaf y, le da un infarto  chicos)@ me entieden
59975,003,Ay Si,Hay siii Te mando un premio pues,Hay si,ii Te mando un premio pues
59979,003,Ay Si,Ay si ay si Cumplo años el mismo dia que naci,Ay si ay si, Cumplo años el mismo dia que naci
60047,012,Willy Wonka,asi que te gusta el yaoi? dime que se siente que tenga censura,asi que te gusta el yaoi? ,dime que se siente que tenga censura
60116,012,Willy Wonka,"asi que eres super sis dime que se siente , no tener capa ??",asi que eres super sis ,dime que se siente  no tener capa ??
60121,003,Ay Si,"Ay si, ay si Voy para Pastor pero no pago las playeras...",Ay si ay si, Voy para Pastor pero no pago las playeras...
60126,004,Bad Luck Brian,"Se va del clan Ganamos guerra, Se une gente activa, se hace guerra de 25 nos regalan gemas y un carro",Se va del clan Ganamos guerra Se une gente activa, se hace guerra de 25 nos regalan gemas y un carro
60131,003,Ay Si,ay ay si se va sami se va pp,ay ay si, se va sami se va pp
60163,003,Ay Si,hay si nenuco nenuco,hay si, nenuco nenuco
60171,012,Willy Wonka,"asi que trabajas en  servicio al cliente dime que se siente estar siempre a su disposicion, atento a sus deseos para poder satisfacerlo",asi que trabajas en  servicio al cliente ,dime que se siente estar siempre a su disposicion atento a sus deseos para poder satisfacerlo
60186,007,Futurama Fry,Mmmmm no se si llamarte ladron o ratero Lo bueno es que no me robaste la billetera,Mmmmm no se si llamarte ladron, o ratero Lo bueno es que no me robaste la billetera
60204,004,Bad Luck Brian,pilas papi con lo que vas hacer ate Claudia,pilas papi con, lo que vas hacer ate Claudia
60238,006,Filosoraptor,a quien me comere hoy ¿a la suegra?,a quien me comere hoy ,¿a la suegra?
60239,006,Filosoraptor,me dijo no me tardo y ya paso un año¿volvera?,me dijo no me tardo y ya paso un año,¿volvera?
60250,004,Bad Luck Brian,Anota su tarea para no olvidarse se olvida donde lo anoto,Anota su tarea para no olvidarse se olvida donde, lo anoto
60339,007,Futurama Fry,nose sies de nasional o es un gay xd,nose sies de nasional, o es un gay xd
60345,004,Bad Luck Brian,ganaba la livertadores se dabacuenta q era gay d nasional,ganaba la livertadores, se dabacuenta q era gay d nasional
60412,003,Ay Si,"ay si, muy enojados con la reforma tributaria pero se nos olvida que el congreso es quien la aprueba y siempre votamos por los mismos",ay si, muy enojados con la reforma tributaria pero se nos olvida que el congreso es quien la aprueba y siempre votamos por los mismos
60417,003,Ay Si,"ay si, muy enojados con la reforma tributaria pero se nos olvida que nosotros elegimos a los politicos que la van a aprobar... de que nos quejamos entonces",ay si, muy enojados con la reforma tributaria pero se nos olvida que nosotros elegimos a los politicos que la van a aprobar... de que nos quejamos entonces
60526,008,Matias Prats,noticia de ultima hora mañ cumple años alguien muy especial en mi vida jeison fernandez te amo,noticia de ultima hora, mañ cumple años alguien muy especial en mi vida jeison fernandez te amo
60590,007,Futurama Fry,o el internet va lento o yo soy muy rapido,o el internet va lento, o yo soy muy rapido
60598,004,Bad Luck Brian,pide un acenso lo despiden,pide un acenso, lo despiden
60644,011,Problems,cuando tienes artos trabajos para la u y no sabes por donde comenzar,cuando tienes artos trabajos para la u, y no sabes por donde comenzar
60653,003,Ay Si,Ay si ay si uso gillete,Ay si ay si, uso gillete
60717,004,Bad Luck Brian,era tan chinbo que se salia del grupo pa no gastar datos,era tan chinbo que, se salia del grupo pa no gastar datos
60807,006,Filosoraptor,"¿Que habia examen? Bueno, pues no he estudiado",,¿Que habia examen? Bueno pues no he estudiado
60808,007,Futurama Fry,20 horas durmiendo y 4 leyendo no se si es la mejor o la ideal vida,20 horas durmiendo y 4 leyendo no se si es la mejor, o la ideal vida
60840,004,Bad Luck Brian,Gana el Valencia No puede restregarlo en la cena porque llueve y no se sale,Gana el Valencia No puede restregarlo en la cena porque llueve y no, se sale
60863,013,Yao Wonka,asi que te gusta llevar amigos doteros a tu casa dime que se siente que te suban el mmr y te bajen tu plata,asi que te gusta llevar amigos doteros a tu casa ,dime que se siente que te suban el mmr y te bajen tu plata
60887,006,Filosoraptor,CUANDO LE DAN TACOS AL PASTOR ¿lE DAN TORTAS A LAS OVEJAS?,CUANDO LE DAN TACOS AL PASTOR ,¿lE DAN TORTAS A LAS OVEJAS?
60934,008,Matias Prats,EN ultimas noticias jefry tiene miedo,EN ultimas noticias, jefry tiene miedo
60958,004,Bad Luck Brian,Le pasan una llamada de quejas viene y se queja,Le pasan una llamada de quejas viene y, se queja
61014,011,Problems,me enseño su tatuaje y era temporal,me enseño su tatuaje, y era temporal
61039,003,Ay Si,"Ay si, ay si mando besos y soy muy macho",Ay si ay si, mando besos y soy muy macho
61068,008,Matias Prats,Noticia de ultima hora Salvador mato 10 gatos,Noticia de ultima hora, Salvador mato 10 gatos
61092,003,Ay Si,Hay si Con ajo,Hay si, Con ajo
61112,004,Bad Luck Brian,Le envian su carta de hogwarts la lechuza se pierde en la cordillera oriental,Le envian su carta de hogwarts la lechuza, se pierde en la cordillera oriental
61153,004,Bad Luck Brian,juega un año para poder entrar en el torneo le toca trabajar el dia de la final,juega un año para poder entrar en el torneo, le toca trabajar el dia de la final
61166,008,Matias Prats,En ultimas noticias El FLAIS se acordo del grupo,En ultimas noticias, El FLAIS se acordo del grupo
61244,010,Prepare Yourself,preparense para los memes y publicaciones del video del peluche,preparense, para los memes y publicaciones del video del peluche
61256,008,Matias Prats,ultimas noticias CD9 fracaso,ultimas noticias, CD9 fracaso
61293,003,Ay Si,Ay si ay si Michell se enoja por un lapiz,Ay si ay si, Michell se enoja por un lapiz
61306,012,Willy Wonka,Oye dime que se siente estar en daniel u. ramirez,Oye ,dime que se siente estar en daniel u. ramirez
61322,004,Bad Luck Brian,va al ensayo .... y se le echa a perder el i pad,va al ensayo .... y, se le echa a perder el i pad
61323,011,Problems,"Mientes, Me haces daño y luego te arrepientes",Mientes Me haces daño, y luego te arrepientes
61335,004,Bad Luck Brian,El henry se cree riko Jajajjajajajajajaa,El henry, se cree riko Jajajjajajajajajaa
61383,004,Bad Luck Brian,Entra al cine a ver saw le cambiaron la entrada por la de las obejas asesinas,Entra al cine a ver saw, le cambiaron la entrada por la de las obejas asesinas
61406,006,Filosoraptor,SI LOS POKEMON SON OVIPAROS ¿PORQUE MILKTANK TIENE UBRES?,SI LOS POKEMON SON OVIPAROS ,¿PORQUE MILKTANK TIENE UBRES?
61535,007,Futurama Fry,no se si tomar hoy... o hoy y mañana,no se si tomar hoy..., o hoy y mañana
61549,003,Ay Si,Ay si ay si Todo mundo hace repaso de el set list de la usb para mayhem hoy,Ay si ay si, Todo mundo hace repaso de el set list de la usb para mayhem hoy
61573,003,Ay Si,ay si ay si solo v.i.p. coma,ay si ay si, solo v.i.p. coma
61603,006,Filosoraptor,Si el coyote tenia plata para dinamita ¿porque no compro comida?,Si el coyote tenia plata para dinamita ,¿porque no compro comida?
61619,004,Bad Luck Brian,se deja picar se muere,se deja picar, se muere
61648,003,Ay Si,"Ay si, ay si ¡Los mongolicos que se la comen hablando ingles!",Ay si ay si, ¡Los mongolicos que se la comen hablando ingles!
61681,004,Bad Luck Brian,Hace plagio le toca con cobos,Hace plagio, le toca con cobos
61694,004,Bad Luck Brian,mary ...golosa te gusta lo grande,mary ...golosa te gusta, lo grande
61705,004,Bad Luck Brian,mary .....  se que te gusta lo grande pero no lo digas en el grupo por favor ¡¡¡,mary ..... , se que te gusta lo grande pero no lo digas en el grupo por favor ¡¡¡
61707,007,Futurama Fry,no se si pol es un pasado o un ofrecido,no se si pol es un pasado, o un ofrecido
61712,007,Futurama Fry,no se si es un pasado o un ofrecido,no se si es un pasado, o un ofrecido
61745,007,Futurama Fry,nose si echar manuela o pamela,nose si echar manuela, o pamela
61764,004,Bad Luck Brian,El Hugo se dice ser colico lino Y viste camiseta de Iquique colico lino,El Hugo, se dice ser colico lino Y viste camiseta de Iquique colico lino
61787,003,Ay Si,cuando te hablan del r. madrid hay si muy bueno,cuando te hablan del r. madrid hay si, muy bueno
61825,004,Bad Luck Brian,se pone broseador lo comfude con tosino,se pone broseador, lo comfude con tosino
61832,003,Ay Si,ay si ay si ... escribo mi nombre y ya hice un momo,ay si ay si, ... escribo mi nombre y ya hice un momo
61856,003,Ay Si,Ay si ay si Edwin solo es un amigo,Ay si ay si, Edwin solo es un amigo
61857,008,Matias Prats,Noticia de ultima hora! Viviana y la familia van en el puente de guadua!!! Jajajajajaj,Noticia de ultima hora,! Viviana y la familia van en el puente de guadua!!! Jajajajajaj
61859,003,Ay Si,Ay si ay si  veo television Pero dormida,Ay si ay si,  veo television Pero dormida
61864,008,Matias Prats,informacion de ultima hora colina es tremendo jala bola!,informacion de ultima hora, colina es tremendo jala bola!
61913,012,Willy Wonka,Asi que eres secretario de desarrollo social? dime que se siente tener la capacidad intelectual de un niño de 3 años,Asi que eres secretario de desarrollo social? ,dime que se siente tener la capacidad intelectual de un niño de 3 años
61925,012,Willy Wonka,Asi que amas a tu ciudad ¿dime que se siente caminar entre basura?,Asi que amas a tu ciudad ¿,dime que se siente caminar entre basura?
61944,003,Ay Si,ay si ay si todas diciendo que van a hacer ejercicio y no salen de sus casas,ay si ay si, todas diciendo que van a hacer ejercicio y no salen de sus casas
62048,007,Futurama Fry,soy yo o luria es demasiado pendejo para skywars??,soy yo, o luria es demasiado pendejo para skywars??
62150,004,Bad Luck Brian,Crea un mountro se vuelve mas famoso que el,Crea un mountro, se vuelve mas famoso que el
62172,012,Willy Wonka,cuentame que se siente tener un equipo mediocre,,cuentame que se siente tener un equipo mediocre
62306,003,Ay Si,"Ay si, ay si asquerosita",Ay si ay si, asquerosita
62426,003,Ay Si,ay si ay si dios dijo:sin alcohol no es fiesta y convirtio el agua en vino,ay si ay si, dios dijo:sin alcohol no es fiesta y convirtio el agua en vino
62438,004,Bad Luck Brian,Dime que se siente Se blanco y bembon,Dime que, se siente Se blanco y bembon
62445,012,Willy Wonka,hola y dime que se siente estar pudriendose aqui,hola y ,dime que se siente estar pudriendose aqui
62474,003,Ay Si,"ay si, ay si! veo terminator",ay si ay si,! veo terminator
62478,003,Ay Si,ay si ay si me puede trolear la wara,ay si ay si, me puede trolear la wara
62491,003,Ay Si,"Ay si,  ay si.. Le voy al america !!",Ay si  ay si,.. Le voy al america !!
62502,003,Ay Si,ay si y tu tines grande el orto,ay si, y tu tines grande el orto
62553,003,Ay Si,Hay si yo lleno la cabeza!!!,Hay si, yo lleno la cabeza!!!
62569,004,Bad Luck Brian,Le pone clave a el usuario de ps4 Se le olvida,Le pone clave a el usuario de ps4 Se, le olvida
62729,008,Matias Prats,Noticia de ultima hora Toño y aurelio se cojen kariño,Noticia de ultima hora, Toño y aurelio se cojen kariño
62740,008,Matias Prats,Noticia de ultima hora Me culie a tu mama,Noticia de ultima hora, Me culie a tu mama
62768,006,Filosoraptor,si no debes hablar con extraños ¿Como hiciste amigos?,si no debes hablar con extraños ,¿Como hiciste amigos?
62774,006,Filosoraptor,si no debes hablar con extraños... ¿Como hiciste amigos?,si no debes hablar con extraños... ,¿Como hiciste amigos?
62780,008,Matias Prats,Noticia de ultima hora!! Domingo dia de felicitaciones a nuestros amigos ferreñiquitos ferro,Noticia de ultima hora,!! Domingo dia de felicitaciones a nuestros amigos ferreñiquitos ferro
62868,003,Ay Si,Ay si ay si Soy puber y Acavo.de sacar cedula,Ay si ay si, Soy puber y Acavo.de sacar cedula
62879,008,Matias Prats,Noticia de ultima hora Voy a ser tio y mis padres abuelos             felicidades Miguel y Nicole,Noticia de ultima hora, Voy a ser tio y mis padres abuelos             felicidades Miguel y Nicole
62927,011,Problems,"Eres un pesimo amante , llegas tarde. Poca diversion y te vas rapido.",Eres un pesimo amante  llegas tarde. Poca diversion, y te vas rapido.
62935,011,Problems,"Eres un pesimo amante , llegas tarde. Poca diversion y te vas rapido. Te  odio fin de semana",Eres un pesimo amante  llegas tarde. Poca diversion, y te vas rapido. Te  odio fin de semana
62942,004,Bad Luck Brian,Como cuando no tienes amigos que se acuerden de tu cumpleaños pero tienes otra cuenta de facebook,Como cuando no tienes amigos que, se acuerden de tu cumpleaños pero tienes otra cuenta de facebook
62961,011,Problems,maicol: no haremos nada fabian: me la dejo seca y roja,maicol: no haremos nada fabian: me la dejo seca, y roja
63098,004,Bad Luck Brian,Le toca el principe de hielo No se le guarda,Le toca el principe de hielo No, se le guarda
63116,011,Problems,lucia te voy a enganchar del collar te voy a bajar aqui y vas a acabar con collarin,lucia te voy a enganchar del collar te voy a bajar aqui, y vas a acabar con collarin
63259,007,Futurama Fry,No se si les mirabas El poto o los ejercicios,No se si les mirabas El poto, o los ejercicios
63261,007,Futurama Fry,No se si les miras El poto o los ejercicios,No se si les miras El poto, o los ejercicios
63270,011,Problems,"pobre, celoso, mentiroso, asolapado y lo peor la tiene chiquita..jajaja",pobre celoso mentiroso asolapado, y lo peor la tiene chiquita..jajaja
63429,011,Problems,Me dijo que me iba a dejar estudiar y me tiene con chistes pendejos,Me dijo que me iba a dejar estudiar, y me tiene con chistes pendejos
63470,008,Matias Prats,ultima hora aparecio mariela,ultima hora, aparecio mariela
63523,011,Problems,Abraham me dijo la puntita nada mas y me la dejo ir toda,Abraham me dijo la puntita nada mas, y me la dejo ir toda
63595,011,Problems,Me dijo que me haria el amor despacio y con cariño No puedo caminar desde entonces,Me dijo que me haria el amor despacio, y con cariño No puedo caminar desde entonces
63611,003,Ay Si,Ay si ay si yo tengo un coreografo y mas barato q el tuyo Yo voy a comprar  ropa y tu no ja ja ja,Ay si ay si, yo tengo un coreografo y mas barato q el tuyo Yo voy a comprar  ropa y tu no ja ja ja
63625,004,Bad Luck Brian,Dijo que era chino Gonzales le creyo,Dijo que era chino Gonzales, le creyo
63646,004,Bad Luck Brian,estudia para ser docente no le interesa la politica,estudia para ser docente no, le interesa la politica
63660,004,Bad Luck Brian,completa la tesis se le olvido cambiar el tema,completa la tesis, se le olvido cambiar el tema
63663,004,Bad Luck Brian,juega undertale lo mata jerry,juega undertale, lo mata jerry
63684,008,Matias Prats,Noticia de ultima hora!! Tengo a las doctoras mas bellas y buenas en mi familia!!,Noticia de ultima hora,!! Tengo a las doctoras mas bellas y buenas en mi familia!!
63706,012,Willy Wonka,ahora que somos amigos dime que se siente tener que soportarme,ahora que somos amigos ,dime que se siente tener que soportarme
63707,008,Matias Prats,ultimas noticias tolerancia y respeto abundante,ultimas noticias, tolerancia y respeto abundante
63708,003,Ay Si,ay si ay si tenemos que respetar pero ni a su mama saluda,ay si ay si, tenemos que respetar pero ni a su mama saluda
63758,004,Bad Luck Brian,es el dia de su cumple lo operan,es el dia de su cumple, lo operan
63837,003,Ay Si,"Ay si uy si Clara la ""social"" me llama creido",Ay si uy si," Clara la ""social"" me llama creido"
63847,007,Futurama Fry,nose si son las elecciones o los matinales,nose si son las elecciones, o los matinales
63859,003,Ay Si,"Ay si, ay si: 23 de octubre Todos recuerdan a los medicos",Ay si ay si,: 23 de octubre Todos recuerdan a los medicos
63904,005,Disaster Girl,habia una araña en mi casa ...habia..,habia una araña en mi casa ...,habia..
63914,003,Ay Si,ay sii pz mocosa ers muy,ay si,i pz mocosa ers muy
63955,004,Bad Luck Brian,Lo llaman de vocal No le pagan,Lo llaman de vocal No, le pagan
63989,004,Bad Luck Brian,Se hace el piola y termina su relacion Ella le dice cornudo,Se hace el piola y termina su relacion Ella, le dice cornudo
63993,004,Bad Luck Brian,Va a votar Se le queda el carnet,Va a votar Se, le queda el carnet
63995,010,Prepare Yourself,preparense las ordas de harley queen se acercan (lo peor es que estaran gordas y prietas las malditas),preparense, las ordas de harley queen se acercan (lo peor es que estaran gordas y prietas las malditas)
64087,004,Bad Luck Brian,Cree que le es fiel Lo cagan hasta con el perro,Cree que, le es fiel Lo cagan hasta con el perro
64089,004,Bad Luck Brian,Jura que le es fiel Lo cagan hasta con el que vende mani,Jura que, le es fiel Lo cagan hasta con el que vende mani
64094,012,Willy Wonka,asi que creaste una pagina nueva dime que se siente no tener nada para publicar,asi que creaste una pagina nueva ,dime que se siente no tener nada para publicar
64099,012,Willy Wonka,"asi que con ella eres bueno,amable y caballero. dime que se siente que prefiera a un mentiroso mujeriego?",asi que con ella eres buenoamable y caballero. ,dime que se siente que prefiera a un mentiroso mujeriego?
64111,012,Willy Wonka,"asi que con ella eres bueno,amable,atento y caballero. dime que siente que prefiera a un mentiroso mujeriego en vez de a ti?",asi que con ella eres buenoamableatento y caballero. ,dime que siente que prefiera a un mentiroso mujeriego en vez de a ti?
64116,012,Willy Wonka,Asi que tienes spotify premium? dime que se siente escuchar toda la musica que quieres?,Asi que tienes spotify premium? ,dime que se siente escuchar toda la musica que quieres?
64124,012,Willy Wonka,y cuentame que se siente ganar sueldo minimo,y ,cuentame que se siente ganar sueldo minimo
64145,012,Willy Wonka,"Asi que ganas sueldo minimo? cuentame, que se siente que no te alcance para nada",Asi que ganas sueldo minimo? ,cuentame que se siente que no te alcance para nada
64226,012,Willy Wonka,dime que se siente fumar en frente de tus compañeros deportistas,,dime que se siente fumar en frente de tus compañeros deportistas
64256,004,Bad Luck Brian,se muda siguiendo al novio la deja sola y nunca lo ve!,se muda siguiendo al novio la deja sola y nunca, lo ve!
64279,003,Ay Si,"Ay si ay si te borre ""Payaso"" madure hombre",Ay si ay si," te borre ""Payaso"" madure hombre"
64324,011,Problems,"UN DIA Vas a extrañar me meta en tu vida , y ya no me importara",UN DIA Vas a extrañar me meta en tu vida , y ya no me importara
64329,011,Problems,el renato me dijo que rankeara con el y baje a bronze 5,el renato me dijo que rankeara con el, y baje a bronze 5
64344,006,Filosoraptor,¿porque el de historia nos pide escuchar la radio si no va a hablar? :v,,¿porque el de historia nos pide escuchar la radio si no va a hablar? :v
64345,004,Bad Luck Brian,va ganado todas sus partidas se conecta el luciano,va ganado todas sus partidas, se conecta el luciano
64382,007,Futurama Fry,no se si estoy trabajando en arica o en tacna,no se si estoy trabajando en arica, o en tacna
64387,008,Matias Prats,en ultimas noticias el ciclo de krebs procuce  fadh2 y nadh,en ultimas noticias, el ciclo de krebs procuce  fadh2 y nadh
64394,008,Matias Prats,en ultimas noticias el ciclo de krebs produce fadh2 y nadh,en ultimas noticias, el ciclo de krebs produce fadh2 y nadh
64397,004,Bad Luck Brian,Juega bo2 zombies se muere con el fuego,Juega bo2 zombies, se muere con el fuego
64424,007,Futurama Fry,no se si bruno es estupido o es un idiota,no se si bruno es estupido, o es un idiota
64651,011,Problems,AVECES QUISIERA QUE EL DIABLO ME LLEVARA luego recuerdo que dios no se lo permitr y se me pasa,AVECES QUISIERA QUE EL DIABLO ME LLEVARA luego recuerdo que dios no se lo permitr, y se me pasa
64652,005,Disaster Girl,en esa casa vivian persona que contaminaban vivian....,en esa casa vivian persona que contaminaban ,vivian....
64655,005,Disaster Girl,Paola no soy celosa decia No me pongo celosa por nadie decia...,Paola no soy celosa decia No me pongo celosa por nadie ,decia...
64660,011,Problems,aveces quisiera que el diablo me llevara luego recuerdo que dios no se lo permite y se me pasa,aveces quisiera que el diablo me llevara luego recuerdo que dios no se lo permite, y se me pasa
64664,003,Ay Si,ay si yo soy el charro de villa de arma,ay si, yo soy el charro de villa de arma
64677,003,Ay Si,"ay si, siempre gano ahora todos quieren pelear",ay si, siempre gano ahora todos quieren pelear
64680,007,Futurama Fry,soy yo o los adm no publican,soy yo, o los adm no publican
64707,003,Ay Si,ay si ay si,ay si ay si,
64751,003,Ay Si,ay si,ay si,
64773,011,Problems,Maldicion!! me quede sin las fuentes y sin el pareo...,Maldicion!! me quede sin las fuentes, y sin el pareo...
64849,012,Willy Wonka,dime ¿que se siente andar con un viejo ? con tal de que pague tus caprichos,,dime ¿que se siente andar con un viejo ? con tal de que pague tus caprichos
64931,011,Problems,"Y yo crei en el  y todo era mentira, no hizo ningun milagro",Y yo crei en el , y todo era mentira no hizo ningun milagro
64938,004,Bad Luck Brian,Al fin consigue oleada heroica lo banean por mamutero,Al fin consigue oleada heroica, lo banean por mamutero
64982,003,Ay Si,uy si!! presumo mi alcoholi,uy si,!! presumo mi alcoholi
64994,011,Problems,Pinchi Jorge Me culio y se fue,Pinchi Jorge Me culio, y se fue
65002,003,Ay Si,ay si ay si soy muy valiente,ay si ay si, soy muy valiente
65021,003,Ay Si,Ay si ay si me hacen bullying con cachi Y me ofendo,Ay si ay si, me hacen bullying con cachi Y me ofendo
65041,006,Filosoraptor,¿y si nos dejamos de guevas.... y agarramos  las metralletas ?,,¿y si nos dejamos de guevas.... y agarramos  las metralletas ?
65044,006,Filosoraptor,"Si hay un modelo de Citroen Berlingo alargado... ...¿Por que no lo llaman ""Berlongo""?",Si hay un modelo de Citroen Berlingo alargado... ...,"¿Por que no lo llaman ""Berlongo""?"
65052,003,Ay Si,Cuando la changa dice que fue a una competencia en Monterrey ay si ay si como si me interesara mejor alejate,Cuando la changa dice que fue a una competencia en Monterrey ay si ay si, como si me interesara mejor alejate
