,meme_id,plantilla,texto_no_tilde,text_1,text_2
109814,012,Willy Wonka,asi que eres frenton dime q se siente parecer un globo terraqueo andante,asi que eres frenton ,dime q se siente parecer un globo terraqueo andante
109816,003,Ay Si,"Ay si, ay si Todos registrandose a ultima hora",Ay si ay si, Todos registrandose a ultima hora
109821,003,Ay Si,ay si ay si hoy soplare mi vela,ay si ay si, hoy soplare mi vela
109862,011,Problems,no me gusta y me siento estresada cuando voy a compra,no me gusta, y me siento estresada cuando voy a compra
109879,012,Willy Wonka,"Soy psicologico clinico Y tu psicologo educativo , dime que se siente ser igual inferior entre los psicologos",Soy psicologico clinico Y tu psicologo educativo  ,dime que se siente ser igual inferior entre los psicologos
109945,011,Problems,no me gusta y me siento estresada cuando voy a compra ... como quisiera que todo sea gratis,no me gusta, y me siento estresada cuando voy a compra ... como quisiera que todo sea gratis
109986,006,Filosoraptor,¿si achilier va de titular uruguay tiene otro delantero?,,¿si achilier va de titular uruguay tiene otro delantero?
110010,004,Bad Luck Brian,roba 500k y lo sancionan por no rol de entorno.,roba 500k y, lo sancionan por no rol de entorno.
110018,011,Problems,"me dijo que era lindo, alto, bueno y resulto que era chiro",me dijo que era lindo alto bueno, y resulto que era chiro
110040,004,Bad Luck Brian,dice que no usa cheats y que encuentra gente de casualidad sube fotos con el wallhack activado y lo banean,dice que no usa cheats y que encuentra gente de casualidad sube fotos con el wallhack activado y, lo banean
110045,004,Bad Luck Brian,dice que le va mal en las notas es primer lugar en el curso,dice que, le va mal en las notas es primer lugar en el curso
110064,004,Bad Luck Brian,reporta a un usuario en foro lo banean por wallhack,reporta a un usuario en foro, lo banean por wallhack
110157,004,Bad Luck Brian,Quieren quitar los memes internet se llena de memes de ellos quitando los memes,Quieren quitar los memes internet, se llena de memes de ellos quitando los memes
110179,004,Bad Luck Brian,Entra al legend a joder le hacen bullyng y lo ponen a chupar bolas,Entra al legend a joder le hacen bullyng y, lo ponen a chupar bolas
110186,004,Bad Luck Brian,vota al pp lo declaran ilegal,vota al pp, lo declaran ilegal
110192,012,Willy Wonka,dime que se siente dejar todo el horno sucio por no usar la tapa,,dime que se siente dejar todo el horno sucio por no usar la tapa
110201,011,Problems,Siempre lo mismo. y lo mismo. Estoy cansada. ..,Siempre lo mismo., y lo mismo. Estoy cansada. ..
110221,003,Ay Si,"ay si, manita manita... EL RANITAS DEFENDIENDO a su chilorio",ay si, manita manita... EL RANITAS DEFENDIENDO a su chilorio
110261,004,Bad Luck Brian,Preguntaba que iban a hacer Y los amigos se van mjp,Preguntaba que iban a hacer Y los amigos, se van mjp
110266,004,Bad Luck Brian,Preguntaba que iban a hacer Y los amigos se van con mjp,Preguntaba que iban a hacer Y los amigos, se van con mjp
110282,008,Matias Prats,noticia de ultima hora!!! la profa de ingles los reprobo a todos,noticia de ultima hora,!!! la profa de ingles los reprobo a todos
110331,008,Matias Prats,ultimas noticias eduardo le arma puras mamadas al legion,ultimas noticias, eduardo le arma puras mamadas al legion
110439,008,Matias Prats,noticia de ultima hora! party en comite de rosello,noticia de ultima hora,! party en comite de rosello
110479,004,Bad Luck Brian,le prestan peliculas se le daña el xbox a lainez,le prestan peliculas, se le daña el xbox a lainez
110499,003,Ay Si,ay si ay si ya puedo usar chat de yahoo!,ay si ay si, ya puedo usar chat de yahoo!
110513,008,Matias Prats,ultimas noticias diego el jugon gana una partida en el canal,ultimas noticias, diego el jugon gana una partida en el canal
110553,004,Bad Luck Brian,Pide md Y le dan sal,Pide md Y, le dan sal
110653,012,Willy Wonka,Pues dime!!Que siente ser el unico del grupo que habla umpalumpiano,Pues ,dime!!Que siente ser el unico del grupo que habla umpalumpiano
110812,003,Ay Si,Ay si ay si Soy de la Uis,Ay si ay si, Soy de la Uis
110927,003,Ay Si,ay si ay si tengo fb y ya no hablo solo por inbox,ay si ay si, tengo fb y ya no hablo solo por inbox
111018,003,Ay Si,"Ay si, ay si nomas gano Trump En Florida y ya estan festejando",Ay si ay si, nomas gano Trump En Florida y ya estan festejando
111065,011,Problems,la cara de yami cuando tiene hambre y el hermano se extiende,la cara de yami cuando tiene hambre, y el hermano se extiende
111076,003,Ay Si,ay si ay si lei 3 veces la bibila,ay si ay si, lei 3 veces la bibila
111113,004,Bad Luck Brian,le dicen que lo quieren pero solo como amigo,le dicen que, lo quieren pero solo como amigo
111155,011,Problems,me dijo que lindo trasero y hablaba de su auto,me dijo que lindo trasero, y hablaba de su auto
111161,004,Bad Luck Brian,Encuentra el amor de su vida Y lo deja por que se entera que salia con la hermana  hace 1 año,Encuentra el amor de su vida Y, lo deja por que se entera que salia con la hermana  hace 1 año
111183,008,Matias Prats,"Noticia de ultima hora insolito,increible e inesperado hubo un accidente en bogota, menos mal no hubo heridos porque todos murieron",Noticia de ultima hora, insolitoincreible e inesperado hubo un accidente en bogota menos mal no hubo heridos porque todos murieron
111370,005,Disaster Girl,decia k estaba loka por mis coreanos ¨decian¨,decia k estaba loka por mis coreanos ¨,decian¨
111724,006,Filosoraptor,Si hablas con errores ortograficos ¿Seran errores de lengua?,Si hablas con errores ortograficos ,¿Seran errores de lengua?
111734,003,Ay Si,Ay si ay si se molesto Por que le dijimos yaoista y no fujoshi,Ay si ay si, se molesto Por que le dijimos yaoista y no fujoshi
111747,003,Ay Si,ay si utiliza un texto ajeno y publica la fuente,ay si, utiliza un texto ajeno y publica la fuente
111922,004,Bad Luck Brian,tiene hambre y lo unico que hay es perro le da gastritis,tiene hambre y, lo unico que hay es perro le da gastritis
111932,004,Bad Luck Brian,tiene hambre y lo unico que hay es perros calientes le da gastritis,tiene hambre y, lo unico que hay es perros calientes le da gastritis
111955,004,Bad Luck Brian,trabaja dando clases por casi un año en universidad le dan 15 mil bs,trabaja dando clases por casi un año en universidad, le dan 15 mil bs
111988,004,Bad Luck Brian,le pregunta a su mama cual es su hijo preferido lo bota de la casa,le pregunta a su mama cual es su hijo preferido, lo bota de la casa
111996,004,Bad Luck Brian,le pregunta a su mama cual es su hijo preferido lo bota de la casa,le pregunta a su mama cual es su hijo preferido, lo bota de la casa
112040,012,Willy Wonka,Asi que no te gusta el rock clasico dime que se siente saber que tu madre cogio con esta musica,Asi que no te gusta el rock clasico ,dime que se siente saber que tu madre cogio con esta musica
112076,008,Matias Prats,Noticia de ultima hora Infonavit anuncio la construccion del Muro entre EU y MX,Noticia de ultima hora, Infonavit anuncio la construccion del Muro entre EU y MX
112112,012,Willy Wonka,"con que odias al fsln dime,,que se siente saber que mandara por 5 años mas",con que odias al fsln ,dimeque se siente saber que mandara por 5 años mas
112194,003,Ay Si,hay si¡¡¡¡ ahora niegas los cargos ¡mirna¡,hay si,¡¡¡¡ ahora niegas los cargos ¡mirna¡
112225,010,Prepare Yourself,Gano Trump preparense para la devaluacion,Gano Trump preparense, para la devaluacion
112268,003,Ay Si,Ay si; ay si... ahora todos se creen Politologos...,Ay si; ay si,... ahora todos se creen Politologos...
112280,003,Ay Si,Ay si; ay si... ahora todos se creen Politologos... ... y nunca han repasado ni una pagina de historia contemporanea.,Ay si; ay si,... ahora todos se creen Politologos... ... y nunca han repasado ni una pagina de historia contemporanea.
112284,004,Bad Luck Brian,Gana las elecciones y dice q al fin seremos #ESTADO51 Donald trump se convierte en presidente,Gana las elecciones y dice q al fin seremos #ESTADO51 Donald trump, se convierte en presidente
112312,003,Ay Si,"ay si ay si el dolar a 25.00 no pasa nada en 1991 ya costaba 3,000.00",ay si ay si, el dolar a 25.00 no pasa nada en 1991 ya costaba 3000.00
112313,007,Futurama Fry,no se si jotearme a mi ex o a cualquiera que se me cruce,no se si jotearme a mi ex, o a cualquiera que se me cruce
112327,012,Willy Wonka,El veloz no se acuerda del concierto pero dime que se siente acordarse de ver solo rabos,El veloz no se acuerda del concierto pero ,dime que se siente acordarse de ver solo rabos
112357,004,Bad Luck Brian,Le arreglan el dpto se muda,Le arreglan el dpto, se muda
112378,003,Ay Si,Ay si ay si Me veo muy guapo de flaco,Ay si ay si, Me veo muy guapo de flaco
112418,006,Filosoraptor,¿porque ya nadie recuerda estos memes ? si fuimos los primeros,,¿porque ya nadie recuerda estos memes ? si fuimos los primeros
112430,012,Willy Wonka,Asi y cuentame Q s siente tener un cel mas inteligente q tu???,Asi y ,cuentame Q s siente tener un cel mas inteligente q tu???
112438,003,Ay Si,"Ay si, ay si Tribijir inis pindiintis",Ay si ay si, Tribijir inis pindiintis
112454,011,Problems,"Me tengo que cambiar el color del cabello, ojos y dejar de cojer sol Para entrar a Estados Unidos",Me tengo que cambiar el color del cabello ojos, y dejar de cojer sol Para entrar a Estados Unidos
112475,008,Matias Prats,Notica de ultima hora Vamos a hacer memes una nueva pagina de memes,Notica de ultima hora, Vamos a hacer memes una nueva pagina de memes
112517,006,Filosoraptor,¿Alguien sabe si mañana hay clases o se suspenden por la construcccion del muro?,,¿Alguien sabe si mañana hay clases o se suspenden por la construcccion del muro?
112524,003,Ay Si,Ay si ay si Ahora todos votaron por Trump,Ay si ay si, Ahora todos votaron por Trump
112541,012,Willy Wonka,Y dime que se siente saber que eres Mexicano Y que ya debes estar preparando la mezcla para el muro,Y ,dime que se siente saber que eres Mexicano Y que ya debes estar preparando la mezcla para el muro
112575,004,Bad Luck Brian,cuando finges estar muerto ? y se acuerdan ti XD,cuando finges estar muerto ? y, se acuerdan ti XD
112598,004,Bad Luck Brian,Se quiere socializar con las chicas Ellas le marginan,Se quiere socializar con las chicas Ellas, le marginan
112652,008,Matias Prats,Noticia de ultima hora Se inunda pontevedra por un descuido de un trabajador en una presa de almofrei,Noticia de ultima hora, Se inunda pontevedra por un descuido de un trabajador en una presa de almofrei
112713,004,Bad Luck Brian,Se hizo el canchero dandole su apoyo a Clinton Gana Trump y se nos pudrio la momia...,Se hizo el canchero dandole su apoyo a Clinton Gana Trump y, se nos pudrio la momia...
112733,003,Ay Si,"uy, si, quiero clases pero me da roche protestar",uy si, quiero clases pero me da roche protestar
112753,004,Bad Luck Brian,Vive en Mendoza Y no le gusta el vino,Vive en Mendoza Y no, le gusta el vino
112767,012,Willy Wonka,asi que tu eres nebel dime que se siente que tu papa no te deje estar con lidia,asi que tu eres nebel ,dime que se siente que tu papa no te deje estar con lidia
112848,006,Filosoraptor,"Me pregunto ¿quien se salio de la pasarela? ""Ray Bradbury",Me pregunto ,"¿quien se salio de la pasarela? ""Ray Bradbury"
112857,003,Ay Si,ay si con una mirada asi y se te quita lo malvada,ay si, con una mirada asi y se te quita lo malvada
112887,006,Filosoraptor,Si trump gano ¿Alquien se salio otra vez de la pasarela?,Si trump gano ,¿Alquien se salio otra vez de la pasarela?
112907,004,Bad Luck Brian,se llama saul su ma no le quiere,se llama saul su ma no, le quiere
112919,007,Futurama Fry,pesa mas 1kg de plumas o 1kg de uvas,pesa mas 1kg de plumas, o 1kg de uvas
112967,004,Bad Luck Brian,quiere ver los CAPÍTULOS de mlp le quita el internet,quiere ver los CAPÍTULOS de mlp, le quita el internet
112968,003,Ay Si,"ay si ay si, voy a joder con publicaciones a usa por elegir a trump pero ellos ni nos joden por el boludo que tenemos de presidente",ay si ay si, voy a joder con publicaciones a usa por elegir a trump pero ellos ni nos joden por el boludo que tenemos de presidente
113002,006,Filosoraptor,¿si tengo <body> primero tengo que tener <head>?,,¿si tengo <body> primero tengo que tener <head>?
113004,007,Futurama Fry,no se si estas jugando o diciendo la verdad,no se si estas jugando, o diciendo la verdad
113012,003,Ay Si,ay si ay si los simpson lo predijeron,ay si ay si, los simpson lo predijeron
113069,011,Problems,cuando lo mas que querias era el premio nobel y te lo roban,cuando lo mas que querias era el premio nobel, y te lo roban
113071,003,Ay Si,"Ay si, ay si, me quejo del triunfo de trump pero vote por peña",Ay si ay si, me quejo del triunfo de trump pero vote por peña
113140,004,Bad Luck Brian,"Vota POR capriles y gana chavez se va a USa, vota por hillary y gana trump",Vota POR capriles y gana chavez, se va a USa vota por hillary y gana trump
113188,004,Bad Luck Brian,Quiere programar en swift Se le daña el Mac,Quiere programar en swift Se, le daña el Mac
113405,004,Bad Luck Brian,fue neutro para que ganara macri se preocupa por donald trump,fue neutro para que ganara macri, se preocupa por donald trump
113439,003,Ay Si,ay si soy tan outsider,ay si, soy tan outsider
113461,003,Ay Si,Ay si ay si ahora todos siguen la politica estadounidense,Ay si ay si, ahora todos siguen la politica estadounidense
113471,011,Problems,ni hago de esos y ya me duele la cabeza,ni hago de esos, y ya me duele la cabeza
113487,012,Willy Wonka,ahora que ya me hablas dime: ya son novios?,ahora que ya me hablas ,dime: ya son novios?
113504,012,Willy Wonka,ASi que dices trabajar honradamente en eua dime que se siente hacerlo de ilegal,ASi que dices trabajar honradamente en eua ,dime que se siente hacerlo de ilegal
113507,003,Ay Si,"Ay si, ay si.. Ahora todos eran los super estudiante",Ay si ay si,.. Ahora todos eran los super estudiante
113729,006,Filosoraptor,quieres mejor la CONVIVENCIA de tu curso pero no quieres participar ¿raro?,quieres mejor la CONVIVENCIA de tu curso pero no quieres participar ,¿raro?
113779,007,Futurama Fry,cuando Gian cuenta un chiste NOSE si reirme o pegarte,cuando Gian cuenta un chiste NOSE si reirme, o pegarte
113790,007,Futurama Fry,cuando Gian cuenta un chiste Nose si reirme o pegarle,cuando Gian cuenta un chiste Nose si reirme, o pegarle
113827,011,Problems,En un momento pense alzar vuelo e irme para EU Pero luego me acorde que Trump gano las elecciones y se me paso!!,En un momento pense alzar vuelo e irme para EU Pero luego me acorde que Trump gano las elecciones, y se me paso!!
113862,006,Filosoraptor,Si Trump gano ¿Alguien se salio otra vez de la pasarela?,Si Trump gano ,¿Alguien se salio otra vez de la pasarela?
113890,013,Yao Wonka,dime que se siente llegar al salon y que te cancelen la clase,,dime que se siente llegar al salon y que te cancelen la clase
113891,013,Yao Wonka,dime que se siente llegar al salon y que te cancelen la clase,,dime que se siente llegar al salon y que te cancelen la clase
113892,006,Filosoraptor,Si Gyarados es un pokemon tipo agua volador: ¿Como es que aprende el ataque llamarada?,Si Gyarados es un pokemon tipo agua volador: ,¿Como es que aprende el ataque llamarada?
113936,003,Ay Si,ay si ME GUSTA 7MO jajajajaja,ay si, ME GUSTA 7MO jajajajaja
113957,008,Matias Prats,Informe de ultima hora Asamblea el lunes 14 de noviembre,Informe de ultima hora, Asamblea el lunes 14 de noviembre
114008,011,Problems,"Hasta cuando iran a bajar los boletos Pasan los dias,semanas y nomas no bajan",Hasta cuando iran a bajar los boletos Pasan los diassemanas, y nomas no bajan
114032,012,Willy Wonka,sofistas: y cuentame socrates como es que se sepa de ti por los demas y no por ti mismo,sofistas: y ,cuentame socrates como es que se sepa de ti por los demas y no por ti mismo
114158,004,Bad Luck Brian,"Es de Mexico y se va a Estados Unidos, Gana Donald Trump",Es de Mexico y, se va a Estados Unidos Gana Donald Trump
114162,004,Bad Luck Brian,El ignacio pide mejor tasa No le dan,El ignacio pide mejor tasa No, le dan
114196,012,Willy Wonka,"cuentame mas, vicenta, querida...",,cuentame mas vicenta querida...
114213,012,Willy Wonka,dime que se siente tener que trabajar el dia del partido de colombia,,dime que se siente tener que trabajar el dia del partido de colombia
114229,012,Willy Wonka,Ahora dime que se siente que se venza a los 5 dias,Ahora ,dime que se siente que se venza a los 5 dias
114230,011,Problems,chingao ya viene d estados unidos y yo ya me impuse a la solteria,chingao ya viene d estados unidos, y yo ya me impuse a la solteria
114251,003,Ay Si,"Uy si, uy si... Ahora todos nos tatuamos..",Uy si uy si,... Ahora todos nos tatuamos..
114285,007,Futurama Fry,no se si esta a favor de trump o esta a favor de keiko,no se si esta a favor de trump, o esta a favor de keiko
114286,008,Matias Prats,noticia de ultima hora faltan 3 dias para la cumbre prepatate,noticia de ultima hora, faltan 3 dias para la cumbre prepatate
114410,004,Bad Luck Brian,aprende a programar se acaba el semestre,aprende a programar, se acaba el semestre
114440,003,Ay Si,ay si te compraron un samsung y publicas hasta cuando cagas,ay si, te compraron un samsung y publicas hasta cuando cagas
114445,004,Bad Luck Brian,se compra celular se le rompe,se compra celular, se le rompe
114448,003,Ay Si,"ay si, ay si yo mañaana te pongo el garrafon",ay si ay si, yo mañaana te pongo el garrafon
114455,004,Bad Luck Brian,Le hecha la culpa a r por el server se lo bajaron por no pagarlo,Le hecha la culpa a r por el server, se lo bajaron por no pagarlo
114471,008,Matias Prats,noticia de ultima hora las personas que su nombre empieza con la letra (a) son las mas hermosas de todo el mundo,noticia de ultima hora, las personas que su nombre empieza con la letra (a) son las mas hermosas de todo el mundo
114484,003,Ay Si,Kevin consiguio amigos ay si,Kevin consiguio amigos ay si,
114494,007,Futurama Fry,No se si asegura la kill... o hace la Ks? Irina,No se si asegura la kill..., o hace la Ks? Irina
114497,012,Willy Wonka,"¿Asi que quieres  hacer mla? dime  que se siente no saber nada  de historia, astrofisica, filosofia,antroplogua, botanica  o psicologia transpersonal?",¿Asi que quieres  hacer mla? ,dime  que se siente no saber nada  de historia astrofisica filosofiaantroplogua botanica  o psicologia transpersonal?
114499,012,Willy Wonka,"¿Asi que quieres  hacer mla? dime  que se siente no saber nada  de historia, astrofisica, filosofia,antroplogia, botanica  o psicologia transpersonal?",¿Asi que quieres  hacer mla? ,dime  que se siente no saber nada  de historia astrofisica filosofiaantroplogia botanica  o psicologia transpersonal?
114513,012,Willy Wonka,"¿Asi que quieres  hacer mla? dime  que se siente no saber nada  de historia,animismo, astrofisica, filosofia,antroplogia, botanica  o psicologia transpersonal?",¿Asi que quieres  hacer mla? ,dime  que se siente no saber nada  de historiaanimismo astrofisica filosofiaantroplogia botanica  o psicologia transpersonal?
114547,008,Matias Prats,Informacion de ultima hora Oscar es un cagado,Informacion de ultima hora, Oscar es un cagado
114566,012,Willy Wonka,¿asi que no fuiste a las charlas de catequesis? dime que se siente ver a tu grupo de amigos alistarse para el ejepucusana 2016,¿asi que no fuiste a las charlas de catequesis? ,dime que se siente ver a tu grupo de amigos alistarse para el ejepucusana 2016
114583,006,Filosoraptor,Si una embarazada se practica la eutanasia ¿cuenta como aborto?,Si una embarazada se practica la eutanasia ,¿cuenta como aborto?
114603,006,Filosoraptor,Si abortar es un derecho ¿vivir es un delito?,Si abortar es un derecho ,¿vivir es un delito?
114618,003,Ay Si,ay si andy  sos el mejor jugando futbol,ay si, andy  sos el mejor jugando futbol
114623,012,Willy Wonka,dime juanda que se siente ser derrotado y caer tan bajo con tus estupideses,,dime juanda que se siente ser derrotado y caer tan bajo con tus estupideses
114642,008,Matias Prats,"noticia de ultima hora en san andres de sotavento, es un delito mirar o tener contacto alguno con los seguidores de isabel godin. hay que mirarlos bonito",noticia de ultima hora, en san andres de sotavento es un delito mirar o tener contacto alguno con los seguidores de isabel godin. hay que mirarlos bonito
114655,008,Matias Prats,"noticia de ultima hora en san andres de sotavento, es un delito mirar o tener contacto alguno con los seguidores de isabel godin. hay que mirarlos bonito sino te demandan",noticia de ultima hora, en san andres de sotavento es un delito mirar o tener contacto alguno con los seguidores de isabel godin. hay que mirarlos bonito sino te demandan
114755,003,Ay Si,Ay si ay si hablan de estados unidos Y no saben ni siquiera la situacion del pais,Ay si ay si, hablan de estados unidos Y no saben ni siquiera la situacion del pais
114784,004,Bad Luck Brian,Viene a Santiago Se le queda el Celu en Chiloe,Viene a Santiago Se, le queda el Celu en Chiloe
114870,012,Willy Wonka,Cuentame mas Terna cuentame mas,Cuentame mas Terna ,cuentame mas
115039,006,Filosoraptor,"SEGUN LOS URIBISTAS, SANTOS ORDENABA LOS ASESINATOS DE LOS FALSOS POSITIVOS EN ESE ORDEN DE IDEAS, ¿SANTOS FUE EL QUE LE DIO DURO A LAS FARC?",SEGUN LOS URIBISTAS SANTOS ORDENABA LOS ASESINATOS DE LOS FALSOS POSITIVOS EN ESE ORDEN DE IDEAS ,¿SANTOS FUE EL QUE LE DIO DURO A LAS FARC?
115065,006,Filosoraptor,Si son hot dogs osea perros calientes ¿Se hacen con perros exitados?,Si son hot dogs osea perros calientes ,¿Se hacen con perros exitados?
115081,003,Ay Si,"ay si, ay si bien puñetas ya no hablo",ay si ay si, bien puñetas ya no hablo
115105,012,Willy Wonka,asi que no hiciste caso dime que se siente que tu mama tenga razon,asi que no hiciste caso ,dime que se siente que tu mama tenga razon
115115,008,Matias Prats,De ultima hora nos confirman que Roger no fue finalmente al asadon de Carlos Pero si sono la 7 Señores!!,De ultima hora, nos confirman que Roger no fue finalmente al asadon de Carlos Pero si sono la 7 Señores!!
115298,007,Futurama Fry,No se si te dice borracho o te esta invitando,No se si te dice borracho, o te esta invitando
115305,008,Matias Prats,ultima hora Sandra encontro a shirley Hernandez,ultima hora, Sandra encontro a shirley Hernandez
115316,003,Ay Si,ay si ay si Agamos fieta sorpesa,ay si ay si, Agamos fieta sorpesa
115333,006,Filosoraptor,"¿Se puede, lejos de lo sagrado y de sus valores absolutos, encontrar la regla de conducta?",,¿Se puede lejos de lo sagrado y de sus valores absolutos encontrar la regla de conducta?
115342,012,Willy Wonka,asi que le vas al America dime que se siente ser el mas grande,asi que le vas al America ,dime que se siente ser el mas grande
115351,012,Willy Wonka,asi que le vas al America dime que se siente ser el mas grande,asi que le vas al America ,dime que se siente ser el mas grande
115377,007,Futurama Fry,no se si todos tienen la autoestima muy alta o yo la tengo muy baja,no se si todos tienen la autoestima muy alta, o yo la tengo muy baja
115388,012,Willy Wonka,asi que te llamas Kevin dime que se siente no tener amigos,asi que te llamas Kevin ,dime que se siente no tener amigos
115395,006,Filosoraptor,"Acaso sera ? Si Hitler hizo jabon con los judios, ¿Donald Trump hara frijoles charros con los mexicanos?",Acaso sera ? Si Hitler hizo jabon con los judios ,¿Donald Trump hara frijoles charros con los mexicanos?
115407,007,Futurama Fry,no se si en la poda mi compa avanza o se regresa,no se si en la poda mi compa avanza, o se regresa
115477,006,Filosoraptor,¿sera que ago el deber? o mañana copio,,¿sera que ago el deber? o mañana copio
115491,003,Ay Si,Ay si aay si estoy gordo Que dramatico!!!!,Ay si aay si, estoy gordo Que dramatico!!!!
115594,008,Matias Prats,Noticias de ultima hora se aproxima La fiesta de jaqueline y su abuelita esta poniendo horarios eso no es de Dios estaremos informando,Noticias de ultima hora, se aproxima La fiesta de jaqueline y su abuelita esta poniendo horarios eso no es de Dios estaremos informando
115639,003,Ay Si,Ay si ay si Ahora quien se aguanta a santiago y valentina con whatsapp,Ay si ay si, Ahora quien se aguanta a santiago y valentina con whatsapp
115746,011,Problems,Le pedi q me hiciera cosas cochinas en la cama ... Se tiro un peo y me tapo con las sabanas,Le pedi q me hiciera cosas cochinas en la cama ... Se tiro un peo, y me tapo con las sabanas
115772,004,Bad Luck Brian,no quiere que compres a empresas de E. U. le molesta que trump quiera quitar  T L C,no quiere que compres a empresas de E. U., le molesta que trump quiera quitar  T L C
115802,012,Willy Wonka,dime que se siente que a nadie le importen tus comentarios,,dime que se siente que a nadie le importen tus comentarios
115810,012,Willy Wonka,asi que eres sofia? dime que siente que te webeen por lo enana que eresm,asi que eres sofia? ,dime que siente que te webeen por lo enana que eresm
115816,003,Ay Si,ay si como no banana estupida,ay si, como no banana estupida
115857,008,Matias Prats,atencion ultima hora jair  pasa mercadeo,atencion ultima hora, jair  pasa mercadeo
115859,003,Ay Si,Ay si ay si gano trump Y a ti que ni trabajas,Ay si ay si, gano trump Y a ti que ni trabajas
115880,013,Yao Wonka,dime que se siente que te formateen tu usb,,dime que se siente que te formateen tu usb
115882,003,Ay Si,Ay si ay si gano trump ya valio Y a ti que ni trabajas,Ay si ay si, gano trump ya valio Y a ti que ni trabajas
115938,012,Willy Wonka,Y dime ¿que se siente ser parte del mejor equipo?,Y ,dime ¿que se siente ser parte del mejor equipo?
115953,008,Matias Prats,Noticia de no ultima hora donald trump gano las elecciones isis prepara aviones kamikazes hacia la casa blanca,Noticia de no ultima hora, donald trump gano las elecciones isis prepara aviones kamikazes hacia la casa blanca
